Review_Model,Competitor_Flag,HP_Class,Segment,Retailer,Comp_Model,Review_Date,Review_Name,Review_Rating,Review_Rating_Label,Review_Title,Review_Content,Seeding_Flag,Verified_Purchase_Flag,Promotion_Flag,Aggregation_Flag,People_Find_Helpful,Syndicated_Source,Response_Date,Response_Text,Response_Name,URL,Scraping_Date,Country,Orginal_Title,Orginal Title
HP ENVY 6055e,No,Vasari Base,ENVY,Amazon,Canon Pixma TS6420a,2024-03-20,D. Tucker,3,1-2-3-star,"Signed up for 6 months free ink, which l haven’t received.",Printer works great. But what happened to the 6 months of free ink?,,Verified Purchase,,Model name: New,0,,,,,https://www.amazon.com/product-reviews/B08XYRVSRT/ref=cm_cr_arp_d_viewopt_fmt?ie=UTF8&reviewerType=all_reviews&formatType=current_format&pageNumber=4&filterByStar=three_star&sortBy=recent,2024-09-18,UK,,
HP ENVY 6055e,No,Vasari Base,ENVY,Amazon,Canon Pixma TS6420a,2024-03-05,Angela,3,1-2-3-star,Ink,The included ink that came with the printer was empty. That was disappointing. Glad I had order extra ink to come with it.,,Verified Purchase,,Model name: New,0,,,,,https://www.amazon.com/product-reviews/B08XYRVSRT/ref=cm_cr_arp_d_viewopt_fmt?ie=UTF8&reviewerType=all_reviews&formatType=current_format&pageNumber=4&filterByStar=three_star&sortBy=recent,2024-09-18,UK,,
HP ENVY 6055e,No,Vasari Base,ENVY,Amazon,Canon Pixma TS6420a,2024-02-29,David A. Rudloff,3,1-2-3-star,Setup was painful!,"Setup was very difficult. My computer had a lot of trouble connecting to the printer via wifi. I ended up calling HP Support. After about an hour on the phone with them, they were able to finally resolve the issue, and the printer now seems to be working fine.",,Verified Purchase,,Model name: New,2,,,,,https://www.amazon.com/product-reviews/B08XYRVSRT/ref=cm_cr_arp_d_viewopt_fmt?ie=UTF8&reviewerType=all_reviews&formatType=current_format&pageNumber=4&filterByStar=three_star&sortBy=recent,2024-09-18,UK,,
HP ENVY 6055e,No,Vasari Base,ENVY,Amazon,Canon Pixma TS6420a,2024-02-21,Kgravitter,3,1-2-3-star,Constant Humming,I would give this a 4 star but the copier makes a weird electronic humming sound when it is turned on.  So if you like to keep your printer powered up I would not recommend.  I also don’t like that the power button is in the back so I have to pull it out a little each time I need to turn it off and on.  Which is often. It also does not automatically power on when a print job is sent. My old one did and I wish I had thought to specifically check for that feature when buying.  I often need to print from other areas of my house and I need to go turn the printer on for it to print- since I can’t leave it powered on due to the humming.  Otherwise this is a nice compact desk/table top printer for the price.  The quality of printing is so far very good.  Paper tray is small so if you print large quantities may want something a little bigger.,,Verified Purchase,,Model name: New,6,,,,,https://www.amazon.com/product-reviews/B08XYRVSRT/ref=cm_cr_arp_d_viewopt_fmt?ie=UTF8&reviewerType=all_reviews&formatType=current_format&pageNumber=4&filterByStar=three_star&sortBy=recent,2024-09-18,UK,,
HP ENVY 6055e,No,Vasari Base,ENVY,Amazon,Canon Pixma TS6420a,2024-02-09,M Weier,3,1-2-3-star,"good quality, color cartridge was out of ink, had to buy 1 to print in both color and black copies",Had to hire Geek squad to connect printer to my computer.  I am not technician but works good.,,Verified Purchase,,Model name: New,0,,,,,https://www.amazon.com/product-reviews/B08XYRVSRT/ref=cm_cr_arp_d_viewopt_fmt?ie=UTF8&reviewerType=all_reviews&formatType=current_format&pageNumber=4&filterByStar=three_star&sortBy=recent,2024-09-18,UK,,
HP ENVY 6055e,No,Vasari Base,ENVY,Amazon,Canon Pixma TS6420a,2024-02-08,Josh Monson,3,1-2-3-star,Makes high pitched noise,"Printer does its job fine, works as intended.But my God, it took me forever to figure out where it was coming from but it emits a barely noticeable (until you notice) high pitched whining noise when it's on. I keep it off now. It's unbearable in my home office for a full workday.If you sit next to it all day it'll be obnoxious. If it's on the other side of the room or you're not in the room with it all day it'll probably be fine.But I felt it was important enough to write a review lol",,Verified Purchase,,Model name: New,3,,,,,https://www.amazon.com/product-reviews/B08XYRVSRT/ref=cm_cr_arp_d_viewopt_fmt?ie=UTF8&reviewerType=all_reviews&formatType=current_format&pageNumber=4&filterByStar=three_star&sortBy=recent,2024-09-18,UK,,
HP ENVY 6055e,No,Vasari Base,ENVY,Amazon,Canon Pixma TS6420a,2024-01-30,GoeyHoytie,3,1-2-3-star,Not recommended,"It is not an easy printer to work with. I would not recommend it to anyone. The quality is fine, but ....",,Verified Purchase,,Model name: New,0,,,,,https://www.amazon.com/product-reviews/B08XYRVSRT/ref=cm_cr_arp_d_viewopt_fmt?ie=UTF8&reviewerType=all_reviews&formatType=current_format&pageNumber=4&filterByStar=three_star&sortBy=recent,2024-09-18,UK,,
HP ENVY 6055e,No,Vasari Base,ENVY,Amazon,Canon Pixma TS6420a,2024-01-24,Veemac,3,1-2-3-star,Connectivity issues,"Only bought this one because the scanner mode on my Envy 5530 is kaput.  So far, constantly having connection issues if I want to print from phone or iPad.  Will use this one for scanning only and use my old Envy 5530 for everything else.",,Verified Purchase,,Model name: New,3,,,,,https://www.amazon.com/product-reviews/B08XYRVSRT/ref=cm_cr_arp_d_viewopt_fmt?ie=UTF8&reviewerType=all_reviews&formatType=current_format&pageNumber=5&filterByStar=three_star&sortBy=recent,2024-09-18,UK,,
HP ENVY 6055e,No,Vasari Base,ENVY,Amazon,Canon Pixma TS6420a,2024-01-19,Tom Moreland,3,1-2-3-star,Where are the adjustments?,"Couldn’t adjust size, light/dark; etc.",,Verified Purchase,,Model name: New,0,,,,,https://www.amazon.com/product-reviews/B08XYRVSRT/ref=cm_cr_arp_d_viewopt_fmt?ie=UTF8&reviewerType=all_reviews&formatType=current_format&pageNumber=5&filterByStar=three_star&sortBy=recent,2024-09-18,UK,,
HP ENVY 6055e,No,Vasari Base,ENVY,Amazon,Canon Pixma TS6420a,2024-01-05,Old Man,3,1-2-3-star,Damaged shipment,Shipping box was damaged upon receipt. Missing ink and maybe documentation but eventually got it working after buying new ink cartridge. Works fine now.,,Verified Purchase,,Model name: New,0,,,,,https://www.amazon.com/product-reviews/B08XYRVSRT/ref=cm_cr_arp_d_viewopt_fmt?ie=UTF8&reviewerType=all_reviews&formatType=current_format&pageNumber=5&filterByStar=three_star&sortBy=recent,2024-09-18,UK,,
HP ENVY 6055e,No,Vasari Base,ENVY,Amazon,Canon Pixma TS6420a,2023-12-18,Joan,3,1-2-3-star,Great size,This printer is a good size for a home. Put the panel was to confusing to read and use. And the power on/off and wi-fi buttons were in the back. Should be either one the side or with the control panel,,Verified Purchase,,Model name: New,0,,,,,https://www.amazon.com/product-reviews/B08XYRVSRT/ref=cm_cr_arp_d_viewopt_fmt?ie=UTF8&reviewerType=all_reviews&formatType=current_format&pageNumber=5&filterByStar=three_star&sortBy=recent,2024-09-18,UK,,
HP ENVY 6055e,No,Vasari Base,ENVY,Amazon,Canon Pixma TS6420a,2023-12-16,Big Bopper,3,1-2-3-star,Hard to set up,Printer was hard to install.  Tech Support Customer Service was hard to understand.  HP needs to have Customer Service based in the USA.  Power Button is on the back of printer and should be on the front - easier to turn on and off that way.,,Verified Purchase,,Model name: New,0,,,,,https://www.amazon.com/product-reviews/B08XYRVSRT/ref=cm_cr_arp_d_viewopt_fmt?ie=UTF8&reviewerType=all_reviews&formatType=current_format&pageNumber=5&filterByStar=three_star&sortBy=recent,2024-09-18,UK,,
HP ENVY 6055e,No,Vasari Base,ENVY,Amazon,Canon Pixma TS6420a,2023-11-19,Dawn,3,1-2-3-star,Larger than expected,For some reason my daughter couldnt comnect this in her dorm room,,Verified Purchase,,Model name: New,0,,,,,https://www.amazon.com/product-reviews/B08XYRVSRT/ref=cm_cr_arp_d_viewopt_fmt?ie=UTF8&reviewerType=all_reviews&formatType=current_format&pageNumber=5&filterByStar=three_star&sortBy=recent,2024-09-18,UK,,
HP ENVY 6055e,No,Vasari Base,ENVY,Amazon,Canon Pixma TS6420a,2023-11-18,D. S. Woodhouse,3,1-2-3-star,Always have bought a HP printer,"Always have bought HP printers and have been happy with them. But couldn't get this to work with my computer. My son advised a different brand ""  "" and I have very happy with it. I don't know why this didn't work.",,Verified Purchase,,Model name: New,0,,,,,https://www.amazon.com/product-reviews/B08XYRVSRT/ref=cm_cr_arp_d_viewopt_fmt?ie=UTF8&reviewerType=all_reviews&formatType=current_format&pageNumber=5&filterByStar=three_star&sortBy=recent,2024-09-18,UK,,
HP ENVY 6055e,No,Vasari Base,ENVY,Amazon,Canon Pixma TS6420a,2023-10-27,Taylor V,3,1-2-3-star,Frequent paper jams,"This printer looks nice, it was easy to set up, and it is not that large and it looks pretty nice. The only issue that I have with this printer is that it has frequent paper jams, and I can’t figure out why.So, outside of the frequent paper jams, it would be a pretty nice item. Also, I am enrolled in instant Ink and that has proved to be very beneficial.so if the printer did not have constant paper jams, I would’ve given it a highest score.",,Verified Purchase,,Model name: New,0,,,,,https://www.amazon.com/product-reviews/B08XYRVSRT/ref=cm_cr_arp_d_viewopt_fmt?ie=UTF8&reviewerType=all_reviews&formatType=current_format&pageNumber=5&filterByStar=three_star&sortBy=recent,2024-09-18,UK,,
HP ENVY 6055e,No,Vasari Base,ENVY,Amazon,Canon Pixma TS6420a,2023-10-24,Ravcon 1974,3,1-2-3-star,Not pleased,"I have had this printer for a few months and at first I was glad to have ordered it as the print quality is good.  However, it was NOT as easy to set up as my other HP printers were.  The constant-on blue light is obnoxious.  The icons on the printer screen tell you nothing as there are no labels.  Couldn't print a sheet of Avery labels as they jammed up the printer.  I have been a proponent of HP for years, but will rethink purchasing another.",,Verified Purchase,,Model name: New,2,,,,,https://www.amazon.com/product-reviews/B08XYRVSRT/ref=cm_cr_arp_d_viewopt_fmt?ie=UTF8&reviewerType=all_reviews&formatType=current_format&pageNumber=5&filterByStar=three_star&sortBy=recent,2024-09-18,UK,,
HP ENVY 6055e,No,Vasari Base,ENVY,Amazon,Canon Pixma TS6420a,2023-10-23,Mariah Pilmer,3,1-2-3-star,When it works it works great,75% of the time the printer is offline and won’t connect to print. It is infuriating. I have bought two and both have the same issue. It is also a very slow printer. Don’t buy!,,Verified Purchase,,Model name: New,8,,,,,https://www.amazon.com/product-reviews/B08XYRVSRT/ref=cm_cr_arp_d_viewopt_fmt?ie=UTF8&reviewerType=all_reviews&formatType=current_format&pageNumber=5&filterByStar=three_star&sortBy=recent,2024-09-18,UK,,
HP ENVY 6055e,No,Vasari Base,ENVY,Amazon,Canon Pixma TS6420a,2024-09-14,Amazon Customer,4,4-5-star,Works well once set up,Easy set up for Tech savvy individuals,,Verified Purchase,,Model name: New,0,,,,,https://www.amazon.com/product-reviews/B08XYRVSRT/ref=cm_cr_arp_d_viewopt_fmt?ie=UTF8&reviewerType=all_reviews&formatType=current_format&pageNumber=1&filterByStar=four_star&sortBy=recent,2024-09-18,UK,,
HP ENVY 6055e,No,Vasari Base,ENVY,Amazon,Canon Pixma TS6420a,2024-09-05,Diana,4,4-5-star,Wireless connection issues and/or college student? PLEASE READ!!!,"PROBLEM SOLVED! For anyone trying to set up this HP Envy 6055e wireless printer at college or where a router is not accessible, I’m writing this review in hopes of saving you time and frustration (at least this is what worked for us). My daughter and I were trying to set up her new printer at college using the enclosed instructions. As directed, she unpacked the printer and plugged it in. She’ll be accessing the printer from her iPhone and MacBook, so she downloaded the HP Smart App on both devices. Using the Smart App on her phone, we received a message that setup should be completed on her laptop first. During this process and after repeated error messages saying the wi-fi password was incorrect (even though it was NOT), we decided to try another method. I learned from her university’s tech page that personal printers are allowed, but must be connected through a direct connection between her printer and her device(s). In other words, her printer cannot connect to the university wi-fi, but should communicate with her devices via “HP Wi-Fi Direct”. Realizing that we needed the printer’s Wi-Fi Direct Name and Password we had to figure out how to retrieve it, since printer setup had not been completed. We decided to re-start the setup process (if I remember correctly) – we powered off the printer and unplugged it for a minute, then plugged it back in and turned it on. We loaded a small amount of paper and inserted the ink cartridges. I’m unable to post the external link, but we searched HP support for HP Envy 6055e Wi-Fi Direct setup. Using the step-by-step instructions, we were able to use the “Information” button on the printer to print out the necessary Wi-Fi Direct Name and Password, TURN ON Wi-Fi Direct and proceed with setup.After several frustrating hours my daughter was finally able to complete setup on both devices and print successfully. The most important thing to note – whether printing from a phone or laptop –  “if you want to print web content, such as an email or cloud-based document, open the item before proceeding.” To sum up, use your regular wi-fi connection to open your document, then use your device’s wi-fi network menu to select your printer (starting with DIRECT and your printer model) and proceed to print.The process sounds complicated, but is fairly straightforward when following the HP Wi-Fi Direct Setup.Although we had hoped the printer would be more user-friendly, we were ultimately satisfied to find a way for her to use it on campus.FYI - During setup we chose NOT to enroll in HP+ or HP Instant InkGood Luck!",,Verified Purchase,,Model name: New,0,,,,,https://www.amazon.com/product-reviews/B08XYRVSRT/ref=cm_cr_arp_d_viewopt_fmt?ie=UTF8&reviewerType=all_reviews&formatType=current_format&pageNumber=1&filterByStar=four_star&sortBy=recent,2024-09-18,UK,,
HP ENVY 6055e,No,Vasari Base,ENVY,Amazon,Canon Pixma TS6420a,2024-08-26,Scrantonpa,4,4-5-star,Easy set up,Works like a dream compared to my older printer.,,Verified Purchase,,Model name: New,0,,,,,https://www.amazon.com/product-reviews/B08XYRVSRT/ref=cm_cr_arp_d_viewopt_fmt?ie=UTF8&reviewerType=all_reviews&formatType=current_format&pageNumber=1&filterByStar=four_star&sortBy=recent,2024-09-18,UK,,
HP ENVY 6055e,No,Vasari Base,ENVY,Amazon,Canon Pixma TS6420a,2024-08-25,Howellfreelance,4,4-5-star,Color is not great,"Pics were blurry, black is great.  Don’t buy for color.",,Verified Purchase,,Model name: New,0,,,,,https://www.amazon.com/product-reviews/B08XYRVSRT/ref=cm_cr_arp_d_viewopt_fmt?ie=UTF8&reviewerType=all_reviews&formatType=current_format&pageNumber=1&filterByStar=four_star&sortBy=recent,2024-09-18,UK,,
HP ENVY 6055e,No,Vasari Base,ENVY,Amazon,Canon Pixma TS6420a,2024-08-25,Prachuab Kwanyuen,4,4-5-star,Expensive Ink cartridges,"The unit is inexpensive and nice, but ink cartridges are expensive.",,Verified Purchase,,Model name: New,0,,,,,https://www.amazon.com/product-reviews/B08XYRVSRT/ref=cm_cr_arp_d_viewopt_fmt?ie=UTF8&reviewerType=all_reviews&formatType=current_format&pageNumber=1&filterByStar=four_star&sortBy=recent,2024-09-18,UK,,
HP ENVY 6055e,No,Vasari Base,ENVY,Amazon,Canon Pixma TS6420a,2024-08-21,evan wirth,4,4-5-star,It works,"It does everything I need it to, however it is probably the slowest printer I've ever used...ever",,Verified Purchase,,Model name: New,0,,,,,https://www.amazon.com/product-reviews/B08XYRVSRT/ref=cm_cr_arp_d_viewopt_fmt?ie=UTF8&reviewerType=all_reviews&formatType=current_format&pageNumber=1&filterByStar=four_star&sortBy=recent,2024-09-18,UK,,
HP ENVY 6055e,No,Vasari Base,ENVY,Amazon,Canon Pixma TS6420a,2024-08-19,glojo,4,4-5-star,It's OK,Our printer died.  I am used to printer that do alot more than this little one.  It's ok if you need a page or two.  This just doesn't make sense on some of the features.  I sure do like HP printers better than the last brand I had.,,Verified Purchase,,Model name: New,0,,,,,https://www.amazon.com/product-reviews/B08XYRVSRT/ref=cm_cr_arp_d_viewopt_fmt?ie=UTF8&reviewerType=all_reviews&formatType=current_format&pageNumber=1&filterByStar=four_star&sortBy=recent,2024-09-18,UK,,
HP ENVY 6055e,No,Vasari Base,ENVY,Amazon,Canon Pixma TS6420a,2024-07-27,Jeanne H.,4,4-5-star,Haven’t used,It is difficult to give reviews when items haven’t been used I purchased this for my grandchildren because my HP envy is years old and works great,,Verified Purchase,,Model name: New,0,,,,,https://www.amazon.com/product-reviews/B08XYRVSRT/ref=cm_cr_arp_d_viewopt_fmt?ie=UTF8&reviewerType=all_reviews&formatType=current_format&pageNumber=1&filterByStar=four_star&sortBy=recent,2024-09-18,UK,,
HP ENVY 6055e,No,Vasari Base,ENVY,Amazon,Canon Pixma TS6420a,2024-07-23,Leah M.  Camara,4,4-5-star,HP6000e good but not as good as HP 7640,"This HP 6000e printer replaces my hp 7640 that I’ve had since 2017. The new 6000 is OK but I prefer the 7640 that unfortunately is not compatible with a fiber optic network I upgraded to. The most annoying and ridiculous item with this printer is that the power switch is in the back of the printer. I guess HP developers aimed to keep the front of printer clean with no operational screen or buttons on front. I dislike this intensely. It’s a pain to have to turn this printer around every time I want to turn it on & off. This HP also connected easily from my IMAC desktop BUT not from my iPHONE 14promax. My phone still cannot find this printer. A problem for later. This printer has a light under the top of the paper output area that changes color to tell you the stage the  printer is in, I.e., solid blue printer on & connected. There’s a solid color & a blinking color that denotes OK or not. But I have to look back at the manual to figure out what the color other than blue means. I connected the printer last night.  HP changed all this, I guess, to have it look new and better. Sometimes it’s better not to fix what isn’t broken. Yes, I would recommend this printer and I would rate this printer a 4.",,Verified Purchase,,Model name: New,0,,,,,https://www.amazon.com/product-reviews/B08XYRVSRT/ref=cm_cr_arp_d_viewopt_fmt?ie=UTF8&reviewerType=all_reviews&formatType=current_format&pageNumber=1&filterByStar=four_star&sortBy=recent,2024-09-18,UK,,
HP ENVY 6055e,No,Vasari Base,ENVY,Amazon,Canon Pixma TS6420a,2024-06-22,K Owens,4,4-5-star,I like it but..,"It took a while to set up. I like the printer but it takes almost 2 minutes to print one page, not using color, just a receipt for payment of one of my bills so it’s just black ink being used. I’ll be contacting support to see what the issue could be. If this is normal I might return it.",,Verified Purchase,,Model name: New,0,,,,,https://www.amazon.com/product-reviews/B08XYRVSRT/ref=cm_cr_arp_d_viewopt_fmt?ie=UTF8&reviewerType=all_reviews&formatType=current_format&pageNumber=1&filterByStar=four_star&sortBy=recent,2024-09-18,UK,,
HP ENVY 6055e,No,Vasari Base,ENVY,Amazon,Canon Pixma TS6420a,2024-06-04,ROCK,4,4-5-star,simple,easy to use,,Verified Purchase,,Model name: New,0,,,,,https://www.amazon.com/product-reviews/B08XYRVSRT/ref=cm_cr_arp_d_viewopt_fmt?ie=UTF8&reviewerType=all_reviews&formatType=current_format&pageNumber=2&filterByStar=four_star&sortBy=recent,2024-09-18,UK,,
HP ENVY 6055e,No,Vasari Base,ENVY,Amazon,Canon Pixma TS6420a,2024-05-28,NV,4,4-5-star,So far so good,A little tricky,,Verified Purchase,,Model name: New,0,,,,,https://www.amazon.com/product-reviews/B08XYRVSRT/ref=cm_cr_arp_d_viewopt_fmt?ie=UTF8&reviewerType=all_reviews&formatType=current_format&pageNumber=2&filterByStar=four_star&sortBy=recent,2024-09-18,UK,,
HP ENVY 6055e,No,Vasari Base,ENVY,Amazon,Canon Pixma TS6420a,2024-05-11,Tony knows,4,4-5-star,Sleek,Does the job and more. Great printer,,Verified Purchase,,Model name: New,0,,,,,https://www.amazon.com/product-reviews/B08XYRVSRT/ref=cm_cr_arp_d_viewopt_fmt?ie=UTF8&reviewerType=all_reviews&formatType=current_format&pageNumber=2&filterByStar=four_star&sortBy=recent,2024-09-18,UK,,
HP ENVY 6055e,No,Vasari Base,ENVY,Amazon,Canon Pixma TS6420a,2024-05-11,Mila Anderson,4,4-5-star,Works good,Difficult to set up,,Verified Purchase,,Model name: New,0,,,,,https://www.amazon.com/product-reviews/B08XYRVSRT/ref=cm_cr_arp_d_viewopt_fmt?ie=UTF8&reviewerType=all_reviews&formatType=current_format&pageNumber=2&filterByStar=four_star&sortBy=recent,2024-09-18,UK,,
HP ENVY 6055e,No,Vasari Base,ENVY,Amazon,Canon Pixma TS6420a,2024-05-06,Cassandra Hallman,4,4-5-star,Easy to use,"I purchased this printer because the other HP I had didn’t offer borderless printing. I did find that this works for some borderless printing, but not for all and I ended up having to use another printer to do some of my prints that required borderless the printer overall works well",,Verified Purchase,,Model name: New,2,,,,,https://www.amazon.com/product-reviews/B08XYRVSRT/ref=cm_cr_arp_d_viewopt_fmt?ie=UTF8&reviewerType=all_reviews&formatType=current_format&pageNumber=2&filterByStar=four_star&sortBy=recent,2024-09-18,UK,,
HP ENVY 6055e,No,Vasari Base,ENVY,Amazon,Canon Pixma TS6420a,2024-05-03,Bonnie Connor,4,4-5-star,Good printet,For printing and copying.,,Verified Purchase,,Model name: New,0,,,,,https://www.amazon.com/product-reviews/B08XYRVSRT/ref=cm_cr_arp_d_viewopt_fmt?ie=UTF8&reviewerType=all_reviews&formatType=current_format&pageNumber=2&filterByStar=four_star&sortBy=recent,2024-09-18,UK,,
HP ENVY 6055e,No,Vasari Base,ENVY,Amazon,Canon Pixma TS6420a,2024-05-03,Deborah Stanford,4,4-5-star,Unsure of it’s quality,It was difficult to set up. I’m not to sure about it performance either.,,Verified Purchase,,Model name: New,0,,,,,https://www.amazon.com/product-reviews/B08XYRVSRT/ref=cm_cr_arp_d_viewopt_fmt?ie=UTF8&reviewerType=all_reviews&formatType=current_format&pageNumber=2&filterByStar=four_star&sortBy=recent,2024-09-18,UK,,
HP ENVY 6055e,No,Vasari Base,ENVY,Amazon,Canon Pixma TS6420a,2024-04-30,MA2010,4,4-5-star,Printer ink,High quality but the ink doesn't last very long.,,Verified Purchase,,Model name: New,0,,,,,https://www.amazon.com/product-reviews/B08XYRVSRT/ref=cm_cr_arp_d_viewopt_fmt?ie=UTF8&reviewerType=all_reviews&formatType=current_format&pageNumber=2&filterByStar=four_star&sortBy=recent,2024-09-18,UK,,
HP ENVY 6055e,No,Vasari Base,ENVY,Amazon,Canon Pixma TS6420a,2024-04-30,Lonnie Gale Thoroman,4,4-5-star,Need better setup instructions,It was a major challenge to initially set up!!,,Verified Purchase,,Model name: New,0,,,,,https://www.amazon.com/product-reviews/B08XYRVSRT/ref=cm_cr_arp_d_viewopt_fmt?ie=UTF8&reviewerType=all_reviews&formatType=current_format&pageNumber=2&filterByStar=four_star&sortBy=recent,2024-09-18,UK,,
HP ENVY 6055e,No,Vasari Base,ENVY,Amazon,Canon Pixma TS6420a,2024-04-23,Lori,4,4-5-star,"Great, compact printer but found it difficult to connect to WIFI","I like it alot - aesthetically pleasing in my office, compact and prints very quickly. The ONLY problem I had was connecting it to my WIFI - I called tech support with no luck then FINALLY after 50 tries it connected. It was not my internet. I am not sure what it was but from the blogs I was not alone. Once I got it working I love it",,Verified Purchase,,Model name: New,0,,,,,https://www.amazon.com/product-reviews/B08XYRVSRT/ref=cm_cr_arp_d_viewopt_fmt?ie=UTF8&reviewerType=all_reviews&formatType=current_format&pageNumber=2&filterByStar=four_star&sortBy=recent,2024-09-18,UK,,
HP ENVY 6055e,No,Vasari Base,ENVY,Amazon,Canon Pixma TS6420a,2024-04-23,Julie Collins,4,4-5-star,Easiest printer ever,We replaced our older HP with this one. The set up was so simple and in no time we were printing from our smartphones and laptops. The quality of print is excellent in color and black ink. Swapping cartridges is so easy. Scanning is easy too. It is slower than our older one; but we no longer require business-level speed. It’s still a great little printer and at this price point it’s hard to find a reliable printer with HP reputation.,,Verified Purchase,,Model name: New,15,,,,,https://www.amazon.com/product-reviews/B08XYRVSRT/ref=cm_cr_arp_d_viewopt_fmt?ie=UTF8&reviewerType=all_reviews&formatType=current_format&pageNumber=3&filterByStar=four_star&sortBy=recent,2024-09-18,UK,,
HP ENVY 6055e,No,Vasari Base,ENVY,Amazon,Canon Pixma TS6420a,2024-04-19,Popcorn maniac,4,4-5-star,Replacement,Didn't realize I couldn't scan to computer. But I was mostly just needing to make copies. My fault for not doing more research.,,Verified Purchase,,Model name: New,0,,,,,https://www.amazon.com/product-reviews/B08XYRVSRT/ref=cm_cr_arp_d_viewopt_fmt?ie=UTF8&reviewerType=all_reviews&formatType=current_format&pageNumber=3&filterByStar=four_star&sortBy=recent,2024-09-18,UK,,
HP ENVY 6055e,No,Vasari Base,ENVY,Amazon,Canon Pixma TS6420a,2024-04-11,Becca,4,4-5-star,Good printer,"The only issue I've seen with this printer is that every few days I have to unplug it to""reset"". Not sure what the issue is but unplugging seems to work.",,Verified Purchase,,Model name: New,0,,,,,https://www.amazon.com/product-reviews/B08XYRVSRT/ref=cm_cr_arp_d_viewopt_fmt?ie=UTF8&reviewerType=all_reviews&formatType=current_format&pageNumber=3&filterByStar=four_star&sortBy=recent,2024-09-18,UK,,
