Review_Model,Competitor_Flag,HP_Class,Segment,Retailer,Comp_Model,Review_Date,Review_Name,Review_Rating,Review_Rating_Label,Review_Title,Review_Content,Seeding_Flag,Verified_Purchase_Flag,Promotion_Flag,Aggregation_Flag,People_Find_Helpful,Syndicated_Source,Response_Date,Response_Text,Response_Name,URL,Scraping_Date,Country,Orginal_Title,Orginal Title
HP ENVY 6055e,No,Vasari Base,ENVY,Amazon,Canon Pixma TS6420a,2024-03-11,LadyHawke,2,1-2-3-star,Worked For Awhile,"I loved this printer when I first got it, easy set up, even for someone not tech savvy. Needless to say, it doesn't always print and has trouble finding my WiFi.  Even resetting and trying again,  it doesn't work. I don't use it excessively,  printing basic things when needed,  so it's not from abuse or mistreatment.  Very upset about this and will look for another printer entirely.",,,,Model name: New,0,,,,,https://www.amazon.com/product-reviews/B08XYRVSRT/ref=cm_cr_arp_d_viewopt_fmt?ie=UTF8&reviewerType=all_reviews&formatType=current_format&pageNumber=5&filterByStar=two_star&sortBy=recent,2024-09-18,UK,,
HP ENVY 6055e,No,Vasari Base,ENVY,Amazon,Canon Pixma TS6420a,2024-03-10,NicciC,2,1-2-3-star,Poor connection and function,The connection is spotty and the lack of a screen for operation is super unhelpful. Spend a little more to get a better printer.,,Verified Purchase,,Model name: New,0,,,,,https://www.amazon.com/product-reviews/B08XYRVSRT/ref=cm_cr_arp_d_viewopt_fmt?ie=UTF8&reviewerType=all_reviews&formatType=current_format&pageNumber=5&filterByStar=two_star&sortBy=recent,2024-09-18,UK,,
HP ENVY 6055e,No,Vasari Base,ENVY,Amazon,Canon Pixma TS6420a,2024-09-11,Bob C.,3,1-2-3-star,"Printer works fine, the networking app not so fine","I gave up in frustration trying to hook the printer up to my Wifi using the HP app that's confusing and didn't work, so I bought a standard USB printer cable(one didn't come with the printer, for shame HP), hooked the printer up to my Windows PC, printed a test page(it was beautiful), and all is well in printer land. Maybe at some point in the future I'll try the Wifi app again, but perhaps not.",,Verified Purchase,,Model name: New,0,,,,,https://www.amazon.com/product-reviews/B08XYRVSRT/ref=cm_cr_arp_d_viewopt_fmt?ie=UTF8&reviewerType=all_reviews&formatType=current_format&pageNumber=1&filterByStar=three_star&sortBy=recent,2024-09-18,UK,,
HP ENVY 6055e,No,Vasari Base,ENVY,Amazon,Canon Pixma TS6420a,2024-09-06,Sandra Rae Hale,3,1-2-3-star,Do not like that you have to add an app to your phone to use it.,Works great but do not like having to use an app on the phone. You should be able to use it from the machine itself. I would not have purchased this one if I had known.,,Verified Purchase,,Model name: New,0,,,,,https://www.amazon.com/product-reviews/B08XYRVSRT/ref=cm_cr_arp_d_viewopt_fmt?ie=UTF8&reviewerType=all_reviews&formatType=current_format&pageNumber=1&filterByStar=three_star&sortBy=recent,2024-09-18,UK,,
HP ENVY 6055e,No,Vasari Base,ENVY,Amazon,Canon Pixma TS6420a,2024-09-03,Shay T,3,1-2-3-star,Don’t sign up for the ink!,Rip off,,Verified Purchase,,Model name: New,0,,,,,https://www.amazon.com/product-reviews/B08XYRVSRT/ref=cm_cr_arp_d_viewopt_fmt?ie=UTF8&reviewerType=all_reviews&formatType=current_format&pageNumber=1&filterByStar=three_star&sortBy=recent,2024-09-18,UK,,
HP ENVY 6055e,No,Vasari Base,ENVY,Amazon,Canon Pixma TS6420a,2024-08-23,Tom,3,1-2-3-star,Scanner is slow,Printer capabilities are fine. It’s just a scanner is very slow and has a hard time hooking to your computer even with manufacturing help spend your money on a better quality printer.,,Verified Purchase,,Model name: New,0,,,,,https://www.amazon.com/product-reviews/B08XYRVSRT/ref=cm_cr_arp_d_viewopt_fmt?ie=UTF8&reviewerType=all_reviews&formatType=current_format&pageNumber=1&filterByStar=three_star&sortBy=recent,2024-09-18,UK,,
HP ENVY 6055e,No,Vasari Base,ENVY,Amazon,Canon Pixma TS6420a,2024-08-20,Amazon Customer,3,1-2-3-star,Pain in the neck,"Every time I send a simple print command for even one page, there’s a problem of one sort or another. The plug-in cord comes off very easily and won’t stay in. Nothing  but frustration with this printer. Now I have to replace it but not with HP. They are all hype and very little service.",,,,Model name: New,0,,,,,https://www.amazon.com/product-reviews/B08XYRVSRT/ref=cm_cr_arp_d_viewopt_fmt?ie=UTF8&reviewerType=all_reviews&formatType=current_format&pageNumber=1&filterByStar=three_star&sortBy=recent,2024-09-18,UK,,
HP ENVY 6055e,No,Vasari Base,ENVY,Amazon,Canon Pixma TS6420a,2024-08-06,Joanne McCabe,3,1-2-3-star,Works well,Reasonable price;  it is more difficult than it should be to set up and the ink cartridges are too expensive but it does work well once you get it set up.,,Verified Purchase,,Model name: New,0,,,,,https://www.amazon.com/product-reviews/B08XYRVSRT/ref=cm_cr_arp_d_viewopt_fmt?ie=UTF8&reviewerType=all_reviews&formatType=current_format&pageNumber=1&filterByStar=three_star&sortBy=recent,2024-09-18,UK,,
HP ENVY 6055e,No,Vasari Base,ENVY,Amazon,Canon Pixma TS6420a,2024-07-27,Kelly,3,1-2-3-star,Defective cartridges,"The cartridges that were sent with my printer were defective . When I contacted HP the rep kept sending me panned messages back that had nothing to do with my issue. The error message was that the cartridges were defective and I kept telling the rep that. The rep would take a long time to get back to me, until they stopped altogether. I decided that I no longer wanted this printer and sent it back.",,Verified Purchase,,Model name: New,0,,,,,https://www.amazon.com/product-reviews/B08XYRVSRT/ref=cm_cr_arp_d_viewopt_fmt?ie=UTF8&reviewerType=all_reviews&formatType=current_format&pageNumber=1&filterByStar=three_star&sortBy=recent,2024-09-18,UK,,
HP ENVY 6055e,No,Vasari Base,ENVY,Amazon,Canon Pixma TS6420a,2024-07-22,Stephen Davis,3,1-2-3-star,WI-FI connection sucks,WI-FI will not stay connected good luck with tech support.,,,,Model name: New,0,,,,,https://www.amazon.com/product-reviews/B08XYRVSRT/ref=cm_cr_arp_d_viewopt_fmt?ie=UTF8&reviewerType=all_reviews&formatType=current_format&pageNumber=1&filterByStar=three_star&sortBy=recent,2024-09-18,UK,,
HP ENVY 6055e,No,Vasari Base,ENVY,Amazon,Canon Pixma TS6420a,2024-07-20,Lee,3,1-2-3-star,Very slow printer,"Easy set up, however, this is a veerrryyy slow printer.  Okay for occasional printing, however, if you have a home office or do a great deal of printing I would not recommend this unit.",,Verified Purchase,,Model name: New,0,,,,,https://www.amazon.com/product-reviews/B08XYRVSRT/ref=cm_cr_arp_d_viewopt_fmt?ie=UTF8&reviewerType=all_reviews&formatType=current_format&pageNumber=1&filterByStar=three_star&sortBy=recent,2024-09-18,UK,,
HP ENVY 6055e,No,Vasari Base,ENVY,Amazon,Canon Pixma TS6420a,2024-07-09,Tina P.,3,1-2-3-star,Slow printer,"Very slow to print. Uses lots of ink. Was harder than my previous HP to connect to my router. Disconnects from phone during printing at times. At times will double print things.. luckily I don’t print a lot. If I did, I’d of returned this & bought a laser printer. Much more efficient, faster & doesn’t waste ink or use a lot of it.",,Verified Purchase,,Model name: New,0,,,,,https://www.amazon.com/product-reviews/B08XYRVSRT/ref=cm_cr_arp_d_viewopt_fmt?ie=UTF8&reviewerType=all_reviews&formatType=current_format&pageNumber=1&filterByStar=three_star&sortBy=recent,2024-09-18,UK,,
HP ENVY 6055e,No,Vasari Base,ENVY,Amazon,Canon Pixma TS6420a,2024-07-09,Himself,3,1-2-3-star,"Great when it works, but impossible to fix","The initial setup seemed to work flawlessly, but then we had an issue with a print job that stalled.  Tried numerous restarts of all associated hardware and uninstalling & reinstalling the drivers and such, but it never got back online.  HP's customer support was a waste of time.  I wound up just returning it and buying a new printer, which seems to work alright.  I'm scared to do anything to possibly test its reliability.Important: During setup, be careful to decline the free ink and HP+ plan, unless you're a professional and actually will run out of ink within weeks.",,Verified Purchase,,Model name: New,0,,,,,https://www.amazon.com/product-reviews/B08XYRVSRT/ref=cm_cr_arp_d_viewopt_fmt?ie=UTF8&reviewerType=all_reviews&formatType=current_format&pageNumber=2&filterByStar=three_star&sortBy=recent,2024-09-18,UK,,
HP ENVY 6055e,No,Vasari Base,ENVY,Amazon,Canon Pixma TS6420a,2024-07-04,Tony m,3,1-2-3-star,Has no display,I had to open the phone on my app everytime to use it. No display.  I returned it,,Verified Purchase,,Model name: New,0,,,,,https://www.amazon.com/product-reviews/B08XYRVSRT/ref=cm_cr_arp_d_viewopt_fmt?ie=UTF8&reviewerType=all_reviews&formatType=current_format&pageNumber=2&filterByStar=three_star&sortBy=recent,2024-09-18,UK,,
HP ENVY 6055e,No,Vasari Base,ENVY,Amazon,Canon Pixma TS6420a,2024-07-02,clarence long,3,1-2-3-star,Thought I was in their web site and was In a hacker site,When I finally get to their web site could not download the driver,,Verified Purchase,,Model name: New,0,,,,,https://www.amazon.com/product-reviews/B08XYRVSRT/ref=cm_cr_arp_d_viewopt_fmt?ie=UTF8&reviewerType=all_reviews&formatType=current_format&pageNumber=2&filterByStar=three_star&sortBy=recent,2024-09-18,UK,,
HP ENVY 6055e,No,Vasari Base,ENVY,Amazon,Canon Pixma TS6420a,2024-06-18,Connie P. W.,3,1-2-3-star,Cumbersome set-up - No help from HP,Set-up was not intuitive and more difficult than expected. The virtual assistant nor the support page were helpful tools.,,Verified Purchase,,Model name: New,0,,,,,https://www.amazon.com/product-reviews/B08XYRVSRT/ref=cm_cr_arp_d_viewopt_fmt?ie=UTF8&reviewerType=all_reviews&formatType=current_format&pageNumber=2&filterByStar=three_star&sortBy=recent,2024-09-18,UK,,
HP ENVY 6055e,No,Vasari Base,ENVY,Amazon,Canon Pixma TS6420a,2024-06-14,Amazon Customer,3,1-2-3-star,It will lock up for no reason,"This would be an excellent printer, but it will randomly just not print documents for no reason. It's connected to wifi, the wifi connection light is blue, it's showing ready and waiting, hit print and it does nothing. I have to unplug it for 20 seconds, plug it back in and then it will print. This happens pretty frequently, too, at least once every other day. Paper jams with this printer are a pain, too. There's no bottom to the printer, so when you lift it up, you see the paper tray and printer rollers. To get the jammed paper out, you have to remove the paper tray completely. The printer then cycles through something and the jammed paper comes out all of a sudden. It's a shame this printer has these regular glitches, because otherwise, it's a good printer.",,,,Model name: New,0,,,,,https://www.amazon.com/product-reviews/B08XYRVSRT/ref=cm_cr_arp_d_viewopt_fmt?ie=UTF8&reviewerType=all_reviews&formatType=current_format&pageNumber=2&filterByStar=three_star&sortBy=recent,2024-09-18,UK,,
HP ENVY 6055e,No,Vasari Base,ENVY,Amazon,Canon Pixma TS6420a,2024-06-14,gh5943,3,1-2-3-star,Not consistent in settings,"Printer goes offline sometimes and is tricky to get online again, even using the USB connection instead of WiFi.",,Verified Purchase,,Model name: New,0,,,,,https://www.amazon.com/product-reviews/B08XYRVSRT/ref=cm_cr_arp_d_viewopt_fmt?ie=UTF8&reviewerType=all_reviews&formatType=current_format&pageNumber=2&filterByStar=three_star&sortBy=recent,2024-09-18,UK,,
HP ENVY 6055e,No,Vasari Base,ENVY,Amazon,Canon Pixma TS6420a,2024-06-10,Jenni,3,1-2-3-star,Quality decreased in a few months,I love this printer when I first bought it. I’ve contacted HP help two times already for the same issue and it’s never been resolved. I had my last HP printer for five years and this one less than a year and I already think I need to buy a new one. The pictures are coming out With roller type lines on them. Or have weird streaks missing. I’ve tried cleaning the printer heads 6+ times And changing out the ink cartridges. Same issue. Was hoping HP would Do an exchange as I only had the printer for a few months. :/,,Verified Purchase,,Model name: New,0,,,,,https://www.amazon.com/product-reviews/B08XYRVSRT/ref=cm_cr_arp_d_viewopt_fmt?ie=UTF8&reviewerType=all_reviews&formatType=current_format&pageNumber=2&filterByStar=three_star&sortBy=recent,2024-09-18,UK,,
HP ENVY 6055e,No,Vasari Base,ENVY,Amazon,Canon Pixma TS6420a,2024-06-05,Amazon Customer,3,1-2-3-star,Connecting to wifi issues,This printer constantly is offline and I have trouble connecting it to wifi.,,Verified Purchase,,Model name: New,0,,,,,https://www.amazon.com/product-reviews/B08XYRVSRT/ref=cm_cr_arp_d_viewopt_fmt?ie=UTF8&reviewerType=all_reviews&formatType=current_format&pageNumber=2&filterByStar=three_star&sortBy=recent,2024-09-18,UK,,
HP ENVY 6055e,No,Vasari Base,ENVY,Amazon,Canon Pixma TS6420a,2024-06-04,Dot Day,3,1-2-3-star,Hard to install!,"I like simple. This was not simple; my Mavbook Air is o er 10 years old and didn’t have e ouch storage. However, it is installed o. The desk PC and works well. I needed the help of some more technologically astute.",,Verified Purchase,,Model name: New,0,,,,,https://www.amazon.com/product-reviews/B08XYRVSRT/ref=cm_cr_arp_d_viewopt_fmt?ie=UTF8&reviewerType=all_reviews&formatType=current_format&pageNumber=2&filterByStar=three_star&sortBy=recent,2024-09-18,UK,,
HP ENVY 6055e,No,Vasari Base,ENVY,Amazon,Canon Pixma TS6420a,2024-05-14,eRa,3,1-2-3-star,It’s good for light home use,"Nice compact, quiet and easy to set up. However, connecting to it wirelessly does not always work and you would have to reboot it or even reinstall at times to connect it. BEWARE of the “instant ink” offer for very affordable ink cartridges cuz if you decide to cancel your subscription the printer will stop working immediately unless you replace cartridges with new full priced cartridges even if what you are using is full.",,Verified Purchase,,Model name: New,0,,,,,https://www.amazon.com/product-reviews/B08XYRVSRT/ref=cm_cr_arp_d_viewopt_fmt?ie=UTF8&reviewerType=all_reviews&formatType=current_format&pageNumber=2&filterByStar=three_star&sortBy=recent,2024-09-18,UK,,
HP ENVY 6055e,No,Vasari Base,ENVY,Amazon,Canon Pixma TS6420a,2024-05-12,Dorothy Jean Gray,3,1-2-3-star,Came with a faulty tri-color ink cartridge,"The tri-color ink cartridge that came with the printer does not work. I keep getting an E0 error code, which means the cartridge is unusable. I feel ripped off.  I could not get customer service to respond. I ended up having to purchase a new cartridge. Terrible customer service.",,Verified Purchase,,Model name: New,0,,,,,https://www.amazon.com/product-reviews/B08XYRVSRT/ref=cm_cr_arp_d_viewopt_fmt?ie=UTF8&reviewerType=all_reviews&formatType=current_format&pageNumber=3&filterByStar=three_star&sortBy=recent,2024-09-18,UK,,
HP ENVY 6055e,No,Vasari Base,ENVY,Amazon,Canon Pixma TS6420a,2024-05-07,C.C.,3,1-2-3-star,"Solid printer at the price point, terrible scanner.","I like the small size (so much easier in a city apartment where space can be tight). And I like the white color (matches my decor better). I've printed less than 20 pages but so far they've been good quality.However, the scanner hasn't been great. Just trying to get a readable quality on some black and white forms is impossible which is quite disappointing. The copier has been okay, not impressive, but functional.",,Verified Purchase,,Model name: New,0,,,,,https://www.amazon.com/product-reviews/B08XYRVSRT/ref=cm_cr_arp_d_viewopt_fmt?ie=UTF8&reviewerType=all_reviews&formatType=current_format&pageNumber=3&filterByStar=three_star&sortBy=recent,2024-09-18,UK,,
HP ENVY 6055e,No,Vasari Base,ENVY,Amazon,Canon Pixma TS6420a,2024-05-01,Zapatista,3,1-2-3-star,App is useful for connecting to network - Not needed for printing thereafter.,"The HP app is ok for connecting to your WI-FI network. Its not needed for printing once the printerhas been added to your network.For example:  When printing from your Mobile device. Use the ""print option"" (share then choose print depending on device). If you do not see the printer, choose the all printers option. A WI-FI listing will show on the menu. If the printer is already on the network, it should show as an option.It will ask to confirm the printing by asking you by selecting the flashing button on the printer panel.",,Verified Purchase,,Model name: New,0,,,,,https://www.amazon.com/product-reviews/B08XYRVSRT/ref=cm_cr_arp_d_viewopt_fmt?ie=UTF8&reviewerType=all_reviews&formatType=current_format&pageNumber=3&filterByStar=three_star&sortBy=recent,2024-09-18,UK,,
HP ENVY 6055e,No,Vasari Base,ENVY,Amazon,Canon Pixma TS6420a,2024-04-18,jerseybeachbum,3,1-2-3-star,EEh!,It looks great but makes good copies but it was connected to my devices but disconnected and I haven’t been able to reconnect it to my phone . Inconvenient.,,Verified Purchase,,Model name: New,0,,,,,https://www.amazon.com/product-reviews/B08XYRVSRT/ref=cm_cr_arp_d_viewopt_fmt?ie=UTF8&reviewerType=all_reviews&formatType=current_format&pageNumber=3&filterByStar=three_star&sortBy=recent,2024-09-18,UK,,
HP ENVY 6055e,No,Vasari Base,ENVY,Amazon,Canon Pixma TS6420a,2024-04-14,D. M. D.,3,1-2-3-star,"Does NOT come with ""free"" ink for 3 months w/o credit card","Was on hold for over 20 minutes with HP Support trying to get a PIN code that was supposed to be included. Finally hung up. The card has NO PIN code on it.  Unable to set up ""FREE"" 3 month ink supply without supply a credit card that they can charge every 3 months. Not everyone has a credit card. I bought this specifically for the ""FREE"" ink supple.",,Verified Purchase,,Model name: New,0,,,,,https://www.amazon.com/product-reviews/B08XYRVSRT/ref=cm_cr_arp_d_viewopt_fmt?ie=UTF8&reviewerType=all_reviews&formatType=current_format&pageNumber=3&filterByStar=three_star&sortBy=recent,2024-09-18,UK,,
HP ENVY 6055e,No,Vasari Base,ENVY,Amazon,Canon Pixma TS6420a,2024-04-10,Kaylee Wallis,3,1-2-3-star,The printer works but.....,The printer works! But unfortunately I think due to poor packaging the colored ink that was pre installed got damaged in shipping. It's like it's clogged and the blue refuses to work so I cannot align the printer without blue ink. And ink is pretty expensive. So due to this I now have to wait longer to make stickers unfortunately 😞,,Verified Purchase,,Model name: New,0,,,,,https://www.amazon.com/product-reviews/B08XYRVSRT/ref=cm_cr_arp_d_viewopt_fmt?ie=UTF8&reviewerType=all_reviews&formatType=current_format&pageNumber=3&filterByStar=three_star&sortBy=recent,2024-09-18,UK,,
HP ENVY 6055e,No,Vasari Base,ENVY,Amazon,Canon Pixma TS6420a,2024-04-09,Printer,3,1-2-3-star,A hassle to use,"My parents got this printer and I used it one time to print off paper work while visiting and loved it & how easy it was to print from the phone. I requested the same one for Christmas about two years ago and since then my personal experience with it has been meh.In the last two years I’ve needed to connect it to three different wifi networks. This first time it took about 2 hours to get it fully connected despite following all instructions exactly. The second time I put it off for about 3 months because it was so irritating to do it the first time, but I still ended up spending over an hour trying to connect it before it finally worked. We moved 2.5 months ago and have yet to even attempt setting it up for the third time. When it was actually connected, the printer itself was fine as far as color, alignment, etc. I feel like it does run out of ink pretty quickly compared t  bb o some other smaller, at home printers though.Honestly, my parents haven’t had any notable issues with their connectivity, but it’s been connected to the same exact wifi & sat in the same exact spot for years so do with that information what you will. I’ve had horrible connectivity issues so bottom line, I wouldn’t recommend it.",,,,Model name: New,0,,,,,https://www.amazon.com/product-reviews/B08XYRVSRT/ref=cm_cr_arp_d_viewopt_fmt?ie=UTF8&reviewerType=all_reviews&formatType=current_format&pageNumber=3&filterByStar=three_star&sortBy=recent,2024-09-18,UK,,
HP ENVY 6055e,No,Vasari Base,ENVY,Amazon,Canon Pixma TS6420a,2024-04-01,Oakleaf,3,1-2-3-star,Too many flashing lights,I liked the printer a lot.  But the flashing lights that tell you what it's doing drove me crazy.  I could not find a way to turn them off.  I returned it.  Some people might think it's fun.,,Verified Purchase,,Model name: New,0,,,,,https://www.amazon.com/product-reviews/B08XYRVSRT/ref=cm_cr_arp_d_viewopt_fmt?ie=UTF8&reviewerType=all_reviews&formatType=current_format&pageNumber=3&filterByStar=three_star&sortBy=recent,2024-09-18,UK,,
HP ENVY 6055e,No,Vasari Base,ENVY,Amazon,Canon Pixma TS6420a,2024-03-29,B. Kingsford,3,1-2-3-star,Make sure to set up as soon as you can.,"This is my second HP Envy and they are great printers for the money and my needs. My complaint is that it is not that easy to get it connected to your network, at least not for me.  Luckily I stumbled across a number you can call for live tech support during the warranty period. 30 days for me. Tech support was great but finding it was not.",,Verified Purchase,,Model name: New,0,,,,,https://www.amazon.com/product-reviews/B08XYRVSRT/ref=cm_cr_arp_d_viewopt_fmt?ie=UTF8&reviewerType=all_reviews&formatType=current_format&pageNumber=3&filterByStar=three_star&sortBy=recent,2024-09-18,UK,,
HP ENVY 6055e,No,Vasari Base,ENVY,Amazon,Canon Pixma TS6420a,2024-03-29,Maria J Celletto,3,1-2-3-star,None,Product works well setup is easy,,Verified Purchase,,Model name: New,0,,,,,https://www.amazon.com/product-reviews/B08XYRVSRT/ref=cm_cr_arp_d_viewopt_fmt?ie=UTF8&reviewerType=all_reviews&formatType=current_format&pageNumber=3&filterByStar=three_star&sortBy=recent,2024-09-18,UK,,
HP ENVY 6055e,No,Vasari Base,ENVY,Amazon,Canon Pixma TS6420a,2024-03-29,Mairead,3,1-2-3-star,It’s just ok,I haven’t had HP for years never really like their products but read the reviews on this one and thought I would try it.  First of all they get you by supplying the ink based on your usage so not sure if that is good or bad but I feel like they are watching me.  Second it seems to be slow compared to my old brother.  I hope I didn’t make a mistake but will give it a good trial,,Verified Purchase,,Model name: New,0,,,,,https://www.amazon.com/product-reviews/B08XYRVSRT/ref=cm_cr_arp_d_viewopt_fmt?ie=UTF8&reviewerType=all_reviews&formatType=current_format&pageNumber=4&filterByStar=three_star&sortBy=recent,2024-09-18,UK,,
HP ENVY 6055e,No,Vasari Base,ENVY,Amazon,Canon Pixma TS6420a,2024-03-28,mvltstation8,3,1-2-3-star,Works Well,Is a nice machine for the price. Not a super fan of having to have a special app just to use.,,Verified Purchase,,Model name: New,0,,,,,https://www.amazon.com/product-reviews/B08XYRVSRT/ref=cm_cr_arp_d_viewopt_fmt?ie=UTF8&reviewerType=all_reviews&formatType=current_format&pageNumber=4&filterByStar=three_star&sortBy=recent,2024-09-18,UK,,
HP ENVY 6055e,No,Vasari Base,ENVY,Amazon,Canon Pixma TS6420a,2024-03-27,Ahmed,3,1-2-3-star,"Good Printer, Awful Support and Incorrect Information.","This printer is a good small office/home printer. It was easy to setup with the wifi. A mobile app is required to use different features and to tap into the configurations, such as knowing the current ink level. The print quality is pretty good. I have used the copy feature but not the fax feature yet. All wifi connected devices can access the printer wirelessly through wifi. You can even print remotely using the cloud-print freature.I would not get another HP printer unfortunately -- even though I know they are good printers, such as this one -- but here's why:1. We printed a maximum of 20 pages (including 2 pages that are printed out during installation to make sure the printer is aligned and the colors look OK). Then, we got a low-ink warning! The black ink cartridges seems to run out in unexpected fast rate, which means that the low price of the printer is going to be offset by this crazy pattern of reordering ink cartridges.2. Due to #1, I decided to subscribe to the HP Ink+.  I thought OK I will subscribe to the 50 pages per month plan (~$6 per month) and they automatically ship the required ink once it gets low (remember, the printer is connected to the wifi).So, the printer box and minimal manual page that is inside has clearly indicated that the HP Ink+ subscription includes a 3 month trial, which is free. Once I signed up using the mobile app, there's no indication what-so-ever regarding that offer. It shows that I'm enrolled and the ink will be shipped and nothing about the 3 month trial.I have been trying to reach out to support to see why I'm not getting the advertised 3 month free trial and it has been a nightmare. The 'virtual chat' feature is useless. It is based on crude AI that doesn't provide any help. The same for the actual support phone number. There's no way to get through a person to speak to, and when I explained the reason I'm calling I get unrelated options, such as: ""Do you want to order a laptop?"" or ""Do you need help with Windows security?"" !!It is a lot of headache and as I said it is quite unfortunate that for a printer of such good technical reviews, you get such an awful support and I didn't get my promised 3 month free trial of HP Ink+.",,Verified Purchase,,Model name: New,16,,,,,https://www.amazon.com/product-reviews/B08XYRVSRT/ref=cm_cr_arp_d_viewopt_fmt?ie=UTF8&reviewerType=all_reviews&formatType=current_format&pageNumber=4&filterByStar=three_star&sortBy=recent,2024-09-18,UK,,
