Review_Model,Competitor_Flag,HP_Class,Segment,Retailer,Comp_Model,Review_Date,Review_Name,Review_Rating,Review_Rating_Label,Review_Title,Review_Content,Seeding_Flag,Verified_Purchase_Flag,Promotion_Flag,Aggregation_Flag,People_Find_Helpful,Syndicated_Source,Response_Date,Response_Text,Response_Name,URL,Scraping_Date,Country,Orginal_Title,Orginal Title
HP ENVY 6055e,No,Vasari Base,ENVY,Amazon,Canon Pixma TS6420a,2024-08-10,Yellowshorebum,2,1-2-3-star,"Nice Scanner, but ink dries out faster than you can print. (waste of ink money)","1. The printer is great when it works, quick plug-and-play installation if you use USB.2. Wireless connection is not as reliable and setup can get bit tricky.3. HUGE NEGATIVE: The ink cartridge dries out just sitting inside the printer after 2-3 months. That means you may end up buying a new cartridge (~$30) every time needing to print.4. Scanner is very good on the other hand.1 star for quick USB setup and 1 star for scanner.",,,,Model name: New,0,,,,,https://www.amazon.com/product-reviews/B08XYRVSRT/ref=cm_cr_arp_d_viewopt_fmt?ie=UTF8&reviewerType=all_reviews&formatType=current_format&pageNumber=2&filterByStar=two_star&sortBy=recent,2024-09-18,UK,,
HP ENVY 6055e,No,Vasari Base,ENVY,Amazon,Canon Pixma TS6420a,2024-08-09,JH,2,1-2-3-star,No printer connected,When this printer is working it works great. But.. every 3 or 4 weeks it loses the WiFi connection and you have to reinstall the printer from scratch! I payed $89 for it and now it’s going for $120. My recommendations is not to buy this printer and Keep shopping.,,Verified Purchase,,Model name: New,0,,,,,https://www.amazon.com/product-reviews/B08XYRVSRT/ref=cm_cr_arp_d_viewopt_fmt?ie=UTF8&reviewerType=all_reviews&formatType=current_format&pageNumber=2&filterByStar=two_star&sortBy=recent,2024-09-18,UK,,
HP ENVY 6055e,No,Vasari Base,ENVY,Amazon,Canon Pixma TS6420a,2024-07-19,Baby Kurian,2,1-2-3-star,EXPENCEIVE.,CATRIDGE CUMCEPTION VERY HIGH. I WAS ONLY ABLE TO PRINT 8 PAGES WITH A CATRIDGE.,,Verified Purchase,,Model name: New,0,,,,,https://www.amazon.com/product-reviews/B08XYRVSRT/ref=cm_cr_arp_d_viewopt_fmt?ie=UTF8&reviewerType=all_reviews&formatType=current_format&pageNumber=2&filterByStar=two_star&sortBy=recent,2024-09-18,UK,,
HP ENVY 6055e,No,Vasari Base,ENVY,Amazon,Canon Pixma TS6420a,2024-07-17,Amy Payne,2,1-2-3-star,This printer has issues with connecting and works inconsistently.,"When the printer connects properly, it's a nice, small printer. Unfortunately, it does not connect properly about 35% of the time. That 35% of the time is infuriating, as it's impossible to get work done in a timely manner. It should not take 30 minutes to an hour of fussing with it or rebooting everything every 3rd time I want to print something. I do not recommend this printer.",,Verified Purchase,,Model name: New,0,,,,,https://www.amazon.com/product-reviews/B08XYRVSRT/ref=cm_cr_arp_d_viewopt_fmt?ie=UTF8&reviewerType=all_reviews&formatType=current_format&pageNumber=2&filterByStar=two_star&sortBy=recent,2024-09-18,UK,,
HP ENVY 6055e,No,Vasari Base,ENVY,Amazon,Canon Pixma TS6420a,2024-07-03,Sarajd22,2,1-2-3-star,Doesn’t stay connected,I was really excited about this printer but it doesn’t stay connected to my wifi. If runs off the laptop or phone so when ever laptop is closed or my phone isn’t near by it disconnects. Then I have to go in there and restart it for it to connect which is annoying my old one connected back right away on its own,,Verified Purchase,,Model name: New,0,,,,,https://www.amazon.com/product-reviews/B08XYRVSRT/ref=cm_cr_arp_d_viewopt_fmt?ie=UTF8&reviewerType=all_reviews&formatType=current_format&pageNumber=3&filterByStar=two_star&sortBy=recent,2024-09-18,UK,,
HP ENVY 6055e,No,Vasari Base,ENVY,Amazon,Canon Pixma TS6420a,2024-07-02,rudy torres,2,1-2-3-star,Dont buy,"If youre looking for a reliable printer, this isnt the one. I have so many issues trying to print or scan anything. I almost nearly every time have issues printing or scanning. I do some home office printing, so nothing intensive but the fact that i have to use the app to print or scan anything is ridiculous. I really wanted to like this but its software and ease of use is not worth the effort or time. I'm better off using my phone app to scan documents. Scanning documents takes an extended period of time with low quality. Just dont get.",,Verified Purchase,,Model name: New,0,,,,,https://www.amazon.com/product-reviews/B08XYRVSRT/ref=cm_cr_arp_d_viewopt_fmt?ie=UTF8&reviewerType=all_reviews&formatType=current_format&pageNumber=3&filterByStar=two_star&sortBy=recent,2024-09-18,UK,,
HP ENVY 6055e,No,Vasari Base,ENVY,Amazon,Canon Pixma TS6420a,2024-07-01,DORTHY,2,1-2-3-star,Printing photos,Would not buy again.  I can not connect to wifi.  Simple as that.  Not happy.,,,,Model name: New,0,,,,,https://www.amazon.com/product-reviews/B08XYRVSRT/ref=cm_cr_arp_d_viewopt_fmt?ie=UTF8&reviewerType=all_reviews&formatType=current_format&pageNumber=3&filterByStar=two_star&sortBy=recent,2024-09-18,UK,,
HP ENVY 6055e,No,Vasari Base,ENVY,Amazon,Canon Pixma TS6420a,2024-06-23,Amazon Customer,2,1-2-3-star,Tempermental,"Used for simple household occasional needs. Too many bells, whistles and blinking colored lights. Randomly stops and loses connection to the computer. Problem fixes in manual are useless. Today, it stopped again and I wasted two hours trying to coax it back up but no luck. I've had many all-in-one printers in my life but this is by far the worst of the worst.",,Verified Purchase,,Model name: New,0,,,,,https://www.amazon.com/product-reviews/B08XYRVSRT/ref=cm_cr_arp_d_viewopt_fmt?ie=UTF8&reviewerType=all_reviews&formatType=current_format&pageNumber=3&filterByStar=two_star&sortBy=recent,2024-09-18,UK,,
HP ENVY 6055e,No,Vasari Base,ENVY,Amazon,Canon Pixma TS6420a,2024-06-19,Amazon Customer,2,1-2-3-star,Horrible Purchase,"Where to begin? The ""free month"" of ink is a scam. They took all of my info and then I got a screen that said to try again later. After several days of ""try(ing) again later"", I gave up. Print quality is poor (even with their premium [expensive] ink). HP customer support is virtually non-existent. They hide behind annoying and difficult to navigate phone trees and useless ""chat"" options. I've owned many HP products, but it would appear that the company has shifted their focus from quality to quantity and to hell with the consumer.",,Verified Purchase,,Model name: New,0,,,,,https://www.amazon.com/product-reviews/B08XYRVSRT/ref=cm_cr_arp_d_viewopt_fmt?ie=UTF8&reviewerType=all_reviews&formatType=current_format&pageNumber=3&filterByStar=two_star&sortBy=recent,2024-09-18,UK,,
HP ENVY 6055e,No,Vasari Base,ENVY,Amazon,Canon Pixma TS6420a,2024-06-13,aesthesias,2,1-2-3-star,Terrible Print Quality,"I bought this over the pandemic for WFH purposes, but after the subscription trial ended, the print quality has substantially deteriorated. Various spots of the page will be smudgey or not print at all. Tends to happen on the edges, but more so on the top of the page than the bottom. I’ve tried cleaning the cartridges, realigning the printer, and all the available tools from the app, but nothing fixes the issue.",,Verified Purchase,,Model name: New,0,,,,,https://www.amazon.com/product-reviews/B08XYRVSRT/ref=cm_cr_arp_d_viewopt_fmt?ie=UTF8&reviewerType=all_reviews&formatType=current_format&pageNumber=3&filterByStar=two_star&sortBy=recent,2024-09-18,UK,,
HP ENVY 6055e,No,Vasari Base,ENVY,Amazon,Canon Pixma TS6420a,2024-06-12,Amanda K Olsen,2,1-2-3-star,Occasionally Works,"Very finicky machine that is constantly giving a ""printing error"" message, but not letting you know what that error is. Often cuts out mid-print or misaligns pages...so you waste a lot of paper and ink to get a print. Often need to turn machine off and on to get it to work. I guess you get what you pay for. Wouldn't recommend this particular HP.",,Verified Purchase,,Model name: New,0,,,,,https://www.amazon.com/product-reviews/B08XYRVSRT/ref=cm_cr_arp_d_viewopt_fmt?ie=UTF8&reviewerType=all_reviews&formatType=current_format&pageNumber=3&filterByStar=two_star&sortBy=recent,2024-09-18,UK,,
HP ENVY 6055e,No,Vasari Base,ENVY,Amazon,Canon Pixma TS6420a,2024-06-10,mhart,2,1-2-3-star,HP has gone downhill,"It took 3 of these machines to get one that worked. In every case wifi connection was an issue. Impossible to troubleshoot myself. HP techs struggled with it. I probably spent 8 hours of my own work and HP techs after a recent move getting it to connect with my Mac. So disappointed, I may have to change to another brand.  Also, it takes a long time to start up with different colored lights flashing, ding-dongs, machine noises. My old HP was a dream, but I moved overseas and had to leave it. Bought the same machine over there and it was simple, no issues with wifi. Had to leave it on recent return to the States, and discovered nothing like it was available, so chose this one. Big mistake.",,Verified Purchase,,Model name: New,0,,,,,https://www.amazon.com/product-reviews/B08XYRVSRT/ref=cm_cr_arp_d_viewopt_fmt?ie=UTF8&reviewerType=all_reviews&formatType=current_format&pageNumber=3&filterByStar=two_star&sortBy=recent,2024-09-18,UK,,
HP ENVY 6055e,No,Vasari Base,ENVY,Amazon,Canon Pixma TS6420a,2024-05-31,Noah,2,1-2-3-star,Prints great but continually getting E0 Errors,"The printer works great but after a couple months I get E0 errors ""unusable cartridge"" the whole time. Which is weird. I've changed ink and always use the proper HP ink that I also get from Amazon. Printer is so frustrating that I'm getting a new one instead.",,Verified Purchase,,Model name: New,0,,,,,https://www.amazon.com/product-reviews/B08XYRVSRT/ref=cm_cr_arp_d_viewopt_fmt?ie=UTF8&reviewerType=all_reviews&formatType=current_format&pageNumber=3&filterByStar=two_star&sortBy=recent,2024-09-18,UK,,
HP ENVY 6055e,No,Vasari Base,ENVY,Amazon,Canon Pixma TS6420a,2024-05-30,Jack levine,2,1-2-3-star,They said it’s a fax but it isn’t,My old hp printer finally croaked. Tech support sold me on this. They said it’s a fax. It can send but not receive. It’s not easy to set up. Every time I call for help they try to sell me something. If you don’t buy the ink plan (which lasts forever) Tech support hangs up on you. Never again.,,,,Model name: New,0,,,,,https://www.amazon.com/product-reviews/B08XYRVSRT/ref=cm_cr_arp_d_viewopt_fmt?ie=UTF8&reviewerType=all_reviews&formatType=current_format&pageNumber=3&filterByStar=two_star&sortBy=recent,2024-09-18,UK,,
HP ENVY 6055e,No,Vasari Base,ENVY,Amazon,Canon Pixma TS6420a,2024-05-26,Liz B,2,1-2-3-star,Print Cartridge Issues,"Print quality was fine, but the printer had a hard time with cartridges.  At one point I called tech support, and it turned out I needed to clean the black cartridge, and then had an issue with the color cartridge being expired, even though it was still half full.  I replaced both cartridges (on the recommendation of tech support) and it worked for a while, but then I started getting ""E0"" flashing errors that wouldn't clear.  I tried cleaning the cartridges and reseating the cartridges multiple times, but the error would never clear.  I called tech support again, but by this time the warranty had expired and they wanted to charge me 20 bucks to help, even though this was really a continuation of the same issues I was having while it was under warranty.  I finally decided I've had enough of the poor quality of this product, and the tech support from HP, so I'm switching brands and going with an Epson (highest rated WiFi printer for home in 2024).  We'll see if that works out better!",,,,Model name: New,0,,,,,https://www.amazon.com/product-reviews/B08XYRVSRT/ref=cm_cr_arp_d_viewopt_fmt?ie=UTF8&reviewerType=all_reviews&formatType=current_format&pageNumber=4&filterByStar=two_star&sortBy=recent,2024-09-18,UK,,
HP ENVY 6055e,No,Vasari Base,ENVY,Amazon,Canon Pixma TS6420a,2024-05-23,KW,2,1-2-3-star,SO FRUSTRATING. Constantly disconnects and really annoying to reconnect,"I've had this printer for ~3 years and I really regret having purchased it. The print and scan quality is great, but it constantly disconnects. Getting it reconnected can be anywhere from a 5-30 minute process, and when you're trying to do something time-sensitive, that's a big problem. Even when it's not disconnected, it has other issues--like today, out of nowhere, it says that this printer doesn't allow scanning (even though I literally scanned something yesterday). Or it will randomly turn on and make a bunch of noise in the middle of the night, and there is apparently no way to stop or reschedule these maintenance cycles (aside from unplugging it). Huuuuuge pain in the neck, honestly. Go elsewhere!",,,,Model name: New,0,,,,,https://www.amazon.com/product-reviews/B08XYRVSRT/ref=cm_cr_arp_d_viewopt_fmt?ie=UTF8&reviewerType=all_reviews&formatType=current_format&pageNumber=4&filterByStar=two_star&sortBy=recent,2024-09-18,UK,,
HP ENVY 6055e,No,Vasari Base,ENVY,Amazon,Canon Pixma TS6420a,2024-05-19,Sharolyn Mathews,2,1-2-3-star,Cheap and worthless,"It does not print in color or black nice, too light. I need a 2 sided printer. Right off From the start it started paper jam. So I tried just printing one side and was going to flip it over still jammed. I've wasted a lot of paper and time. Sick of all the flashing lights and digging paper out.",,Verified Purchase,,Model name: New,0,,,,,https://www.amazon.com/product-reviews/B08XYRVSRT/ref=cm_cr_arp_d_viewopt_fmt?ie=UTF8&reviewerType=all_reviews&formatType=current_format&pageNumber=4&filterByStar=two_star&sortBy=recent,2024-09-18,UK,,
HP ENVY 6055e,No,Vasari Base,ENVY,Amazon,Canon Pixma TS6420a,2024-05-09,Stephen G Hartranft,2,1-2-3-star,Installation troubles,Initial installation required 3+ hours of remote tech support to connect to wireless network.  Then only 2 of the 3 computers on the network would recognize it.  Replaced the router and now it won't connect to the wireless network again.  All troubleshooting aids seem to require the printer be already connected.,,,,Model name: New,0,,,,,https://www.amazon.com/product-reviews/B08XYRVSRT/ref=cm_cr_arp_d_viewopt_fmt?ie=UTF8&reviewerType=all_reviews&formatType=current_format&pageNumber=4&filterByStar=two_star&sortBy=recent,2024-09-18,UK,,
HP ENVY 6055e,No,Vasari Base,ENVY,Amazon,Canon Pixma TS6420a,2024-05-08,mistereo,2,1-2-3-star,Occasional use? It will die like all the others.,"I don't think it's possible to have an inkjet printer that will stay functional with occasional use. the one that lasted longest was my Epson printer 20 years ago. My Canon died, and this one is dying after couple of years, printing a couple of times a month. It's always an abusive relationship with inkjet printers. At first it seems magic. This one with its  printing from my phone with the app that seemed to work well. Then it became kinda creepy with the app trying to sell me ink and keep track of how much I'm using it. It seems more determined to make sure I'm using actual HP ink than being able to print. When I stopped using the subscription ink and the ink that I had from the subscription would not work because I was no longer subscribed, I realized that this printer was a gold digger. I admit that I was verbally abusive to the printer, but that was just a lashing out from my powerlessness to get the damned thing to work. Now after paying through the nose for occasional printer cartridges, the clunky app that is more marketing than function tells me that I should maybe change the printhead. That's the amazing diagnostic power of decades of printer ""progress"". I think we, the peasants, should stage an uprising against the 3 or 4 printer manufacturers that collude to make this aspect of our lives annoying. But we won't. Sigh.Well, that felt good to get uff my chest.",,,,Model name: New,0,,,,,https://www.amazon.com/product-reviews/B08XYRVSRT/ref=cm_cr_arp_d_viewopt_fmt?ie=UTF8&reviewerType=all_reviews&formatType=current_format&pageNumber=4&filterByStar=two_star&sortBy=recent,2024-09-18,UK,,
HP ENVY 6055e,No,Vasari Base,ENVY,Amazon,Canon Pixma TS6420a,2024-04-24,eviem,2,1-2-3-star,connectivity with MacBooks,Two issues Ive had with this printer...connectivity with my wifi (Ive had to disconnect and reconnect numerous times) and it will not print in color from my Macbook Air.  Ive tried everything recommended by tech support but it has never printed in color.,,,,Model name: New,0,,,,,https://www.amazon.com/product-reviews/B08XYRVSRT/ref=cm_cr_arp_d_viewopt_fmt?ie=UTF8&reviewerType=all_reviews&formatType=current_format&pageNumber=4&filterByStar=two_star&sortBy=recent,2024-09-18,UK,,
HP ENVY 6055e,No,Vasari Base,ENVY,Amazon,Canon Pixma TS6420a,2024-04-15,LBLI,2,1-2-3-star,"Total trash, should have kept my prior one.","Constantly disconnects from the computer, ""printer cannot be found"" so I have to unplug it and plug it back in, what a nuisance, it should just work all the time. Save yourself the headache and buy something else.",,,,Model name: New,0,,,,,https://www.amazon.com/product-reviews/B08XYRVSRT/ref=cm_cr_arp_d_viewopt_fmt?ie=UTF8&reviewerType=all_reviews&formatType=current_format&pageNumber=4&filterByStar=two_star&sortBy=recent,2024-09-18,UK,,
HP ENVY 6055e,No,Vasari Base,ENVY,Amazon,Canon Pixma TS6420a,2024-04-15,Tetraeder,2,1-2-3-star,Basic functions not working,"Connectivity issues all the time. If you have no connectivity issues the printer will run into another error. A simple print job may take you an hour. Reset / Logins (why???) / hard resets, prayers and hopes. Simply a terrible and not reliable product.",,Verified Purchase,,Model name: New,0,,,,,https://www.amazon.com/product-reviews/B08XYRVSRT/ref=cm_cr_arp_d_viewopt_fmt?ie=UTF8&reviewerType=all_reviews&formatType=current_format&pageNumber=4&filterByStar=two_star&sortBy=recent,2024-09-18,UK,,
HP ENVY 6055e,No,Vasari Base,ENVY,Amazon,Canon Pixma TS6420a,2024-04-11,Ashley,2,1-2-3-star,Pretty good!,This printer never works. It always has an error or is offline. So frustrating,,Verified Purchase,,Model name: New,0,,,,,https://www.amazon.com/product-reviews/B08XYRVSRT/ref=cm_cr_arp_d_viewopt_fmt?ie=UTF8&reviewerType=all_reviews&formatType=current_format&pageNumber=4&filterByStar=two_star&sortBy=recent,2024-09-18,UK,,
HP ENVY 6055e,No,Vasari Base,ENVY,Amazon,Canon Pixma TS6420a,2024-04-09,Amazon Customer,2,1-2-3-star,this printer does not work,"YOU CAN  NOT PRINT EITHER ON THE SCREEN DIRECTLY OR BY COMPUTER TO PRINTER.  i HAVE BEEN TRYING FOR A LEASE TWO MONTHS.  NOW THAT I CAN NOT RETURN IT , I WILL NEED TO EAT THE EXPENSE AND BUY A NEW ONE",,Verified Purchase,,Model name: New,0,,,,,https://www.amazon.com/product-reviews/B08XYRVSRT/ref=cm_cr_arp_d_viewopt_fmt?ie=UTF8&reviewerType=all_reviews&formatType=current_format&pageNumber=4&filterByStar=two_star&sortBy=recent,2024-09-18,UK,,
HP ENVY 6055e,No,Vasari Base,ENVY,Amazon,Canon Pixma TS6420a,2024-04-07,Jeffrey M. Rutschow,2,1-2-3-star,It’s a hassle.,"This printer is a pain in the neck. You have to get an app (or 2) and sign up for a subscription. If you just want to print, scan and copy with a few buttons, this is NOT the right machine.In addition, there’s a “smart” order for ink cartridges & we were sent the wrong ones (even though we registered with  the serial number.). It’s too annoying to deal with.",,Verified Purchase,,Model name: New,0,,,,,https://www.amazon.com/product-reviews/B08XYRVSRT/ref=cm_cr_arp_d_viewopt_fmt?ie=UTF8&reviewerType=all_reviews&formatType=current_format&pageNumber=5&filterByStar=two_star&sortBy=recent,2024-09-18,UK,,
HP ENVY 6055e,No,Vasari Base,ENVY,Amazon,Canon Pixma TS6420a,2024-04-05,elphyandfiyero,2,1-2-3-star,"Do NOT buy, especially if you're a teacher","I'm a teacher and bought this printer to print a few sheets for students (when needed) instead of going all the way to the office to print one sheet. When it works, it works. HOWEVER, every other day it doesn't want to print. Or I have to go the long way and save the file as a PDF then put that file into the HP app. And that's IF it still decides to print. It's more problems than it's worth. I love HP products but this one is a dud.",,Verified Purchase,,Model name: New,0,,,,,https://www.amazon.com/product-reviews/B08XYRVSRT/ref=cm_cr_arp_d_viewopt_fmt?ie=UTF8&reviewerType=all_reviews&formatType=current_format&pageNumber=5&filterByStar=two_star&sortBy=recent,2024-09-18,UK,,
HP ENVY 6055e,No,Vasari Base,ENVY,Amazon,Canon Pixma TS6420a,2024-03-31,Amazon Customer,2,1-2-3-star,This printers nickname is Office Space,"The nickname is because it reminds me of the Xerox machine from the movie! I spend more time trying to get the darn thing to get on line than anything else. After many hours of convincing myself to not take a bat to it, it will start working. The next day it tells me that it's connected to my wi-fi network but not connected to the internet, so no scanning for me. Then there's the monthly fee of having the right to be able to use the machine that you bought, I mean to never run out of ink. This all-in-one printer is on the top of my regrettable purchased list!",,Verified Purchase,,Model name: New,0,,,,,https://www.amazon.com/product-reviews/B08XYRVSRT/ref=cm_cr_arp_d_viewopt_fmt?ie=UTF8&reviewerType=all_reviews&formatType=current_format&pageNumber=5&filterByStar=two_star&sortBy=recent,2024-09-18,UK,,
HP ENVY 6055e,No,Vasari Base,ENVY,Amazon,Canon Pixma TS6420a,2024-03-26,Amazon Customer,2,1-2-3-star,Sorry I Bought It!,"I've had this for a few months now and it was fine at first.  I signed up for the Instant Ink service which was free for a couple of months.  When I knew the free period was ending I tried logging in to the HP Instant Ink account I had set up.  I tried for weeks and kept getting an error message.  Finally, after being billed over $28.00 because I used more pages than my plan allowed (because I couldn't access my account to check!!), I tried calling the support number.  We all know how long it can take to get a live person on these 'support' lines.  I finally got through to an agent (who was very nice, btw) and cancelled the Instant Ink.  He told me my ink would no longer work and there was no option to pay for the extra cartridge they had sent.  Just a ridiculous situation.  I won't use HP again.",,Verified Purchase,,Model name: New,0,,,,,https://www.amazon.com/product-reviews/B08XYRVSRT/ref=cm_cr_arp_d_viewopt_fmt?ie=UTF8&reviewerType=all_reviews&formatType=current_format&pageNumber=5&filterByStar=two_star&sortBy=recent,2024-09-18,UK,,
HP ENVY 6055e,No,Vasari Base,ENVY,Amazon,Canon Pixma TS6420a,2024-03-25,Amy,2,1-2-3-star,"Constant, horrible high-pitched sound","I think this was my 4th HP Envy printer because they've always worked well for me; however, I dislike this one so much I am going to throw it away.  The deal-breaker is the high-pitched squeal constantly emitted from the printer, even in sleep mode.  I researched the issue, which apparently is quite common with this model.  It was suggested to try different power cords.  I've tried three with no improvement.Other cons for me include the over-simplicity of the buttons on the printer.  There is no screen or text, just symbols which are not obvious to me.  I have to use my phone app to do tasks I could previously do through the menu on my previous Envy printers, such as copy or check ink levels.  I also do not like the distracting, colorful lights coming from the printer, even in sleep mode.The printer prints and connected well for me.",,Verified Purchase,,Model name: New,0,,,,,https://www.amazon.com/product-reviews/B08XYRVSRT/ref=cm_cr_arp_d_viewopt_fmt?ie=UTF8&reviewerType=all_reviews&formatType=current_format&pageNumber=5&filterByStar=two_star&sortBy=recent,2024-09-18,UK,,
HP ENVY 6055e,No,Vasari Base,ENVY,Amazon,Canon Pixma TS6420a,2024-03-22,Adele Quinn,2,1-2-3-star,Don't Waste Your Time With This Printer,"I didn't realize it didn't print on two sides but not a deal breaker. What was a deal breaker was when after a week or so, the printer decided what it wanted to print and when and how many. Hours later the printer would start spewing out what I had asked for with numerous copies. Went through a lot of ink because of it. Returned it for an upgraded Envy. Not much better. Remote scanning that I couldn't figure out. That is going back, too.",,Verified Purchase,,Model name: New,0,,,,,https://www.amazon.com/product-reviews/B08XYRVSRT/ref=cm_cr_arp_d_viewopt_fmt?ie=UTF8&reviewerType=all_reviews&formatType=current_format&pageNumber=5&filterByStar=two_star&sortBy=recent,2024-09-18,UK,,
HP ENVY 6055e,No,Vasari Base,ENVY,Amazon,Canon Pixma TS6420a,2024-03-19,carpenter,2,1-2-3-star,HP Printer,"It was not easy to set up and he wants to much info on me. Had an error first thing trying to use, had to replace the ink cartridges on day one just to correct the problem.",,Verified Purchase,,Model name: New,0,,,,,https://www.amazon.com/product-reviews/B08XYRVSRT/ref=cm_cr_arp_d_viewopt_fmt?ie=UTF8&reviewerType=all_reviews&formatType=current_format&pageNumber=5&filterByStar=two_star&sortBy=recent,2024-09-18,UK,,
HP ENVY 6055e,No,Vasari Base,ENVY,Amazon,Canon Pixma TS6420a,2024-03-17,Minne2,2,1-2-3-star,Connectivity horrid,The printed pages come out looking good but the connectivity issue is a big mess.  Took hours to connect even though I have great internet connectivity for everything else.  This model doesn't like Windows 11.  Instant Ink is a scam.  It looks great but expensive night light as someone else mentioned.,,,,Model name: New,0,,,,,https://www.amazon.com/product-reviews/B08XYRVSRT/ref=cm_cr_arp_d_viewopt_fmt?ie=UTF8&reviewerType=all_reviews&formatType=current_format&pageNumber=5&filterByStar=two_star&sortBy=recent,2024-09-18,UK,,
