Review_Model,Competitor_Flag,HP_Class,Segment,Retailer,Comp_Model,Review_Date,Review_Name,Review_Rating,Review_Rating_Label,Review_Title,Review_Content,Seeding_Flag,Verified_Purchase_Flag,Promotion_Flag,Aggregation_Flag,People_Find_Helpful,Syndicated_Source,Response_Date,Response_Text,Response_Name,URL,Scraping_Date,Country,Orginal_Title,Orginal Title
HP ENVY 6055e,No,Vasari Base,ENVY,Amazon,Canon Pixma TS6420a,2024-09-17,Patricia D  Brumit,1,1-2-3-star,Cheaply made,"Did not like anything about it, it was returned",,Verified Purchase,,Model name: New,0,,,,,https://www.amazon.com/product-reviews/B08XYRVSRT/ref=cm_cr_arp_d_viewopt_fmt?ie=UTF8&reviewerType=all_reviews&formatType=current_format&pageNumber=1&filterByStar=one_star&sortBy=recent,2024-09-18,UK,,
HP ENVY 6055e,No,Vasari Base,ENVY,Amazon,Canon Pixma TS6420a,2024-09-16,Grandma,1,1-2-3-star,Waste of money,"This printer has so many issues with software.  Error messages on every print, it prints double of every print request. I have searched for answers and from the extent of comments it is typical for this model.  I have tried all the suggestions and it will work once or twice and they all re-appear.  I am fed up.",,Verified Purchase,,Model name: New,0,,,,,https://www.amazon.com/product-reviews/B08XYRVSRT/ref=cm_cr_arp_d_viewopt_fmt?ie=UTF8&reviewerType=all_reviews&formatType=current_format&pageNumber=1&filterByStar=one_star&sortBy=recent,2024-09-18,UK,,
HP ENVY 6055e,No,Vasari Base,ENVY,Amazon,Canon Pixma TS6420a,2024-09-15,Y,1,1-2-3-star,AVOID THIS NIGHTMARE ! ! !,"DO NOT buy the HP ENVY 6055e.I repeat, DO NOT BUY IT :(Worst piece of junk i've ever own compared to anything I've ever owned in my entire life!HP webpage won't help either.I bought it brand new, since day 1 until many years later, worst piece of garbage ever!Just save your time, which sadly I spent too much of my time trying to fix all the troubleshoots on this piece of garbage, so save your time, buy another brand, HP is no good anymore!",,,,Model name: New,0,,,,,https://www.amazon.com/product-reviews/B08XYRVSRT/ref=cm_cr_arp_d_viewopt_fmt?ie=UTF8&reviewerType=all_reviews&formatType=current_format&pageNumber=1&filterByStar=one_star&sortBy=recent,2024-09-18,UK,,
HP ENVY 6055e,No,Vasari Base,ENVY,Amazon,Canon Pixma TS6420a,2024-09-15,1Gal2Islands,1,1-2-3-star,DOES NOT PRINT IN COLOR (MACBOOK),"This replaced my older Envy printer. The last one was perfect. This one prints well - fast and clear - in black and white, but it does NOT print in color. I can find no way in the app to choose color printing. I'm using a MacBook Air laptop with the most up-to-date operating system. If it printed in color, I'd give it five stars, but as it is, not worth the money.",,Verified Purchase,,Model name: New,0,,,,,https://www.amazon.com/product-reviews/B08XYRVSRT/ref=cm_cr_arp_d_viewopt_fmt?ie=UTF8&reviewerType=all_reviews&formatType=current_format&pageNumber=1&filterByStar=one_star&sortBy=recent,2024-09-18,UK,,
HP ENVY 6055e,No,Vasari Base,ENVY,Amazon,Canon Pixma TS6420a,2024-09-15,Amazon Customer,1,1-2-3-star,"Errors, Ink Drain, More Errors",Expensive ink drains faster than any other printer I’ve owned.  Almost every print job inspires an error code that’s either real or the machine is reporting an error that isn’t happening— either way it’s a time suck and a frustration.,,Verified Purchase,,Model name: New,0,,,,,https://www.amazon.com/product-reviews/B08XYRVSRT/ref=cm_cr_arp_d_viewopt_fmt?ie=UTF8&reviewerType=all_reviews&formatType=current_format&pageNumber=1&filterByStar=one_star&sortBy=recent,2024-09-18,UK,,
HP ENVY 6055e,No,Vasari Base,ENVY,Amazon,Canon Pixma TS6420a,2024-09-14,david Lutz,1,1-2-3-star,Better off with a paper weight,Waste of money. You will throw your life away trying to print a single document. The App they force you to use is a scam to consume your personnel information. If your document isn't in a PDF format it will not except your print request. This thing is limited and cheap. Don't waste your time or money.,,Verified Purchase,,Model name: New,0,,,,,https://www.amazon.com/product-reviews/B08XYRVSRT/ref=cm_cr_arp_d_viewopt_fmt?ie=UTF8&reviewerType=all_reviews&formatType=current_format&pageNumber=1&filterByStar=one_star&sortBy=recent,2024-09-18,UK,,
HP ENVY 6055e,No,Vasari Base,ENVY,Amazon,Canon Pixma TS6420a,2024-09-13,Cypress3223,1,1-2-3-star,Garbage printer,"Printed 10 pictures and now it won’t print anything went through all HP troubleshooting steps and nothing fixed it. If you plan on printing pictures choose a better printer, the pic used is what it does now that’s it, printer is garbage and haven’t even owned it a month.",,Verified Purchase,,Model name: New,0,,,,,https://www.amazon.com/product-reviews/B08XYRVSRT/ref=cm_cr_arp_d_viewopt_fmt?ie=UTF8&reviewerType=all_reviews&formatType=current_format&pageNumber=1&filterByStar=one_star&sortBy=recent,2024-09-18,UK,,
HP ENVY 6055e,No,Vasari Base,ENVY,Amazon,Canon Pixma TS6420a,2024-09-13,Kelsey A.,1,1-2-3-star,N/A,This printer was difficult to connect. The ink ran out immediately. I printed 2-3 pages and the ink needed to be replaced. Not worth the hype. Don’t recommend.,,Verified Purchase,,Model name: New,0,,,,,https://www.amazon.com/product-reviews/B08XYRVSRT/ref=cm_cr_arp_d_viewopt_fmt?ie=UTF8&reviewerType=all_reviews&formatType=current_format&pageNumber=1&filterByStar=one_star&sortBy=recent,2024-09-18,UK,,
HP ENVY 6055e,No,Vasari Base,ENVY,Amazon,Canon Pixma TS6420a,2024-09-13,Pamela O.,1,1-2-3-star,Prints duplicate pages when copies =0 causing additional charges on HPInstant Ink.,The printer erroneously prints multiple copies when printing from my iPhone 15-on several occasions it printed several 10 page documents multiple times. This caused an overrun on my HP InstantInk plan and incurred additional charges. I have opened 2 cases to get the charges reversed and did not receive an answer on either. I cancelled my HPInstant Ink account to avoid further erroneous charges. I spent 6 hours with tech support/used the diagnostic tools to no avail-the only solution appears to be to stand over the printer and turn it off when it starts to generate an unwanted copy. If you buy this printer DO NOT purchase an HPInstantInk plan.,,Verified Purchase,,Model name: New,0,,,,,https://www.amazon.com/product-reviews/B08XYRVSRT/ref=cm_cr_arp_d_viewopt_fmt?ie=UTF8&reviewerType=all_reviews&formatType=current_format&pageNumber=1&filterByStar=one_star&sortBy=recent,2024-09-18,UK,,
HP ENVY 6055e,No,Vasari Base,ENVY,Amazon,Canon Pixma TS6420a,2024-09-12,BarbR,1,1-2-3-star,NOT EASY TO USE,One gets what they pay for and this printer is difficult to operate in our opinion.,,Verified Purchase,,Model name: New,0,,,,,https://www.amazon.com/product-reviews/B08XYRVSRT/ref=cm_cr_arp_d_viewopt_fmt?ie=UTF8&reviewerType=all_reviews&formatType=current_format&pageNumber=1&filterByStar=one_star&sortBy=recent,2024-09-18,UK,,
HP ENVY 6055e,No,Vasari Base,ENVY,Amazon,Canon Pixma TS6420a,2024-09-12,M Muller,1,1-2-3-star,Difficult to print from different devices,"I STILL cannot print consistently from my Samsung phone. EMails, IF they print, come out crammed onto the left edge. My last email didnt print the subject line, didn't print the 'T'  the F or D (To, From, Date) and printed 2 1/2 lines of the message.  I was lucky to get that much out and it took ~1/4 hr. I am able to print about half the time from my PC. I downloaded Samsung apps to help, wireless apps to help. Nothing. Another individual cannot print anything from the iPad. I'm sick of it. Unfortunately, the printer was bought in June. This is September. Clicking the user support under Amazon did not open any help. I have  searched and tried all kinds of help on the web. I've converted data to pdfs ...wait wait wait no print. Done.",,Verified Purchase,,Model name: New,0,,,,,https://www.amazon.com/product-reviews/B08XYRVSRT/ref=cm_cr_arp_d_viewopt_fmt?ie=UTF8&reviewerType=all_reviews&formatType=current_format&pageNumber=2&filterByStar=one_star&sortBy=recent,2024-09-18,UK,,
HP ENVY 6055e,No,Vasari Base,ENVY,Amazon,Canon Pixma TS6420a,2024-09-11,Joan S.,1,1-2-3-star,I HATE THIS PRINTER,"I hate this printer and not only did I buy one, I bought 2. Worked great with my phone initially then the required ink subscription ran out and I bought HP brand ink at Office Depot and it will only print with banded lines, if and when it decides to print at all.Connectivity is very complicated- like in the 1990s- hit or mis, sometimes it connects, sometimes it says off line and it appears to be totally random. I have communicated with HP Customer support and they can not solve the issues.I do not recommend this printer. And certainly do not buy two!!",,Verified Purchase,,Model name: New,0,,,,,https://www.amazon.com/product-reviews/B08XYRVSRT/ref=cm_cr_arp_d_viewopt_fmt?ie=UTF8&reviewerType=all_reviews&formatType=current_format&pageNumber=2&filterByStar=one_star&sortBy=recent,2024-09-18,UK,,
HP ENVY 6055e,No,Vasari Base,ENVY,Amazon,Canon Pixma TS6420a,2024-09-10,Lauren M. Mackenzie,1,1-2-3-star,The worst printer ive ever owned,"Please dont waste your money. It never works, consistently has issues that the app doesn’t give you solutions or support for",,Verified Purchase,,Model name: New,0,,,,,https://www.amazon.com/product-reviews/B08XYRVSRT/ref=cm_cr_arp_d_viewopt_fmt?ie=UTF8&reviewerType=all_reviews&formatType=current_format&pageNumber=2&filterByStar=one_star&sortBy=recent,2024-09-18,UK,,
HP ENVY 6055e,No,Vasari Base,ENVY,Amazon,Canon Pixma TS6420a,2024-09-10,Mim,1,1-2-3-star,Don’t buy this- JUNK! Why can’t I give zero stars?,"This printer does not connect via a cable with the computer, but only through Wi-Fi and the connection fails repeatedly despite my having fast Wi-Fi. New cartridges often are confused by the printer is being sub subscription service only. If you want more complaints, look for the Reddit groups where everyone complains about HP 6000 series printers. Do not be deceived by the fact that this thing looks sexy.",,Verified Purchase,,Model name: New,0,,,,,https://www.amazon.com/product-reviews/B08XYRVSRT/ref=cm_cr_arp_d_viewopt_fmt?ie=UTF8&reviewerType=all_reviews&formatType=current_format&pageNumber=2&filterByStar=one_star&sortBy=recent,2024-09-18,UK,,
HP ENVY 6055e,No,Vasari Base,ENVY,Amazon,Canon Pixma TS6420a,2024-09-10,R.,1,1-2-3-star,Freezes up,"Worst printer ever!! Freezes up, wont copy and error pop every 8 prints",,Verified Purchase,,Model name: New,0,,,,,https://www.amazon.com/product-reviews/B08XYRVSRT/ref=cm_cr_arp_d_viewopt_fmt?ie=UTF8&reviewerType=all_reviews&formatType=current_format&pageNumber=2&filterByStar=one_star&sortBy=recent,2024-09-18,UK,,
HP ENVY 6055e,No,Vasari Base,ENVY,Amazon,Canon Pixma TS6420a,2024-09-10,Patricia A. Hansen,1,1-2-3-star,Utterly useless,"I need a multifunction printer even though I don't print very often, so I bought this HP thinking I'd save some money.  It was still a waste.  It just won't print unless the moon is in retrograde and Aquarius is rising, and sometimes not even then.  It worked okay for a while, though I wasn't entirely happy with the print quality.  My old Canon had sharp edges on the print, nice and clean, and the HP doesn't.  But okay, whatever.  It didn't matter that much.  But recently, all it does it flash multiple lights at me, and nothing I do fixes it.  I've looked at the HP support site and did all the steps, and nada.  So I unplug it to make the flashing lights stop, and HP sends me an email about how my printer isn't connected.  And to add to the fun, HP is still charging me for the instant ink thing, even though their own report shows I haven't printed anything.  All in all, I'm not a happy camper and I'll be looking for a replacement printer.",,,,Model name: New,0,,,,,https://www.amazon.com/product-reviews/B08XYRVSRT/ref=cm_cr_arp_d_viewopt_fmt?ie=UTF8&reviewerType=all_reviews&formatType=current_format&pageNumber=2&filterByStar=one_star&sortBy=recent,2024-09-18,UK,,
HP ENVY 6055e,No,Vasari Base,ENVY,Amazon,Canon Pixma TS6420a,2024-09-09,Amazon Customer,1,1-2-3-star,"After 1 year, broken faulty product, horrible “customer service”","I’ve owned this product for only a year. It started working just fine when I first received it. After using it probably 5 times over a year, the ink stopped working almost completely. I tried to follow their steps for cleaning the ink heads/cartridges, but it still wasn’t working. I googled a phone number to actually talk to a person, and finally after wrestling with an automated system for 20 min, I was talking to what sounded like an AI generated voice. They informed me that since my printer was out of warranty by 2 weeks, he was going to have to charge me $19.99 to give me support with my printer. I don’t know of a better printer company, they may all be trash, but I know for a fact that this one in particular is terrible",,Verified Purchase,,Model name: New,0,,,,,https://www.amazon.com/product-reviews/B08XYRVSRT/ref=cm_cr_arp_d_viewopt_fmt?ie=UTF8&reviewerType=all_reviews&formatType=current_format&pageNumber=2&filterByStar=one_star&sortBy=recent,2024-09-18,UK,,
HP ENVY 6055e,No,Vasari Base,ENVY,Amazon,Canon Pixma TS6420a,2024-09-09,P. O'Brien,1,1-2-3-star,Did not come with Set Up Ink. Support Services VERY POOR,I have tried to obtain set up in cartridges for this printer four times since May.  Every request I’ve put into HP was canceled and the printer is non-functional.  I am extremely frustrated with HP and their return policy or their unwillingness to make this right by sending the required cartridges.,,Verified Purchase,,Model name: New,0,,,,,https://www.amazon.com/product-reviews/B08XYRVSRT/ref=cm_cr_arp_d_viewopt_fmt?ie=UTF8&reviewerType=all_reviews&formatType=current_format&pageNumber=2&filterByStar=one_star&sortBy=recent,2024-09-18,UK,,
HP ENVY 6055e,No,Vasari Base,ENVY,Amazon,Canon Pixma TS6420a,2024-09-09,C. Baltus,1,1-2-3-star,I was never able to connect this printer,Very disappointed with this HP printer I spent hours and never got it on Wi-Fi. The HP app would not even find it. Kept me in an eternal loop. No explanation as to what all the flashing lights meant super super disappointed Never had trouble like this with HP I will not be buying again,,Verified Purchase,,Model name: New,0,,,,,https://www.amazon.com/product-reviews/B08XYRVSRT/ref=cm_cr_arp_d_viewopt_fmt?ie=UTF8&reviewerType=all_reviews&formatType=current_format&pageNumber=2&filterByStar=one_star&sortBy=recent,2024-09-18,UK,,
HP ENVY 6055e,No,Vasari Base,ENVY,Amazon,Canon Pixma TS6420a,2024-09-09,Elaine W. Tanoos,1,1-2-3-star,PRINTER IS NOT DEPENDABLE,"When the printer works, almost never, the print quality is ok. However, I teach and need a reliable pritner. This is not working out for me. Hours are lost getting the printer back online. Then, after a page or two of printing, it is offline again. What a nightmare. I love my HP laptop, but I will never get another HP printer.",,,,Model name: New,0,,,,,https://www.amazon.com/product-reviews/B08XYRVSRT/ref=cm_cr_arp_d_viewopt_fmt?ie=UTF8&reviewerType=all_reviews&formatType=current_format&pageNumber=2&filterByStar=one_star&sortBy=recent,2024-09-18,UK,,
HP ENVY 6055e,No,Vasari Base,ENVY,Amazon,Canon Pixma TS6420a,2024-09-08,Ny2maine,1,1-2-3-star,A complete piece of crap,"Want to print something? Get ready to spend the next hour clearing paper jams....doesn't matter if YOU IRON the paper, fan out the paper, put in a half load of paper....this will jam...every single time...if buy this piece of junk, you need to be prepared to spend your time driving to Staples or the Library whenever you need something printed out.",,,,Model name: New,0,,,,,https://www.amazon.com/product-reviews/B08XYRVSRT/ref=cm_cr_arp_d_viewopt_fmt?ie=UTF8&reviewerType=all_reviews&formatType=current_format&pageNumber=3&filterByStar=one_star&sortBy=recent,2024-09-18,UK,,
HP ENVY 6055e,No,Vasari Base,ENVY,Amazon,Canon Pixma TS6420a,2024-09-07,Melike,1,1-2-3-star,Never buy!,"Don’t waste your money! Even with minimal use, the cartridge runs out! This cost me a lot 😓😡",,Verified Purchase,,Model name: New,0,,,,,https://www.amazon.com/product-reviews/B08XYRVSRT/ref=cm_cr_arp_d_viewopt_fmt?ie=UTF8&reviewerType=all_reviews&formatType=current_format&pageNumber=3&filterByStar=one_star&sortBy=recent,2024-09-18,UK,,
HP ENVY 6055e,No,Vasari Base,ENVY,Amazon,Canon Pixma TS6420a,2024-09-06,Sunny Rowe,1,1-2-3-star,DISAPPOINTED,"I tried to set this up, to no avail. I had to return it.",,Verified Purchase,,Model name: New,0,,,,,https://www.amazon.com/product-reviews/B08XYRVSRT/ref=cm_cr_arp_d_viewopt_fmt?ie=UTF8&reviewerType=all_reviews&formatType=current_format&pageNumber=3&filterByStar=one_star&sortBy=recent,2024-09-18,UK,,
HP ENVY 6055e,No,Vasari Base,ENVY,Amazon,Canon Pixma TS6420a,2024-09-06,a,1,1-2-3-star,For the Love Of All That is Holy Do Not Buy This,"This product is such a piece of garbage. It doesn't come with a usb cable but it has a USB port. You have to connect to wifi just to use thing. I have wifi and can't use it because it prompts me for a WPS Pin when I am trying to connect it and I have zero clue where this pin number is. There are no answers online, the video guides on HP website are all wrong and so I can't use it. This is the most aggrevating and beyond stupid design that I have ever seen. I am returning for a refund ASAP.",,Verified Purchase,,Model name: New,0,,,,,https://www.amazon.com/product-reviews/B08XYRVSRT/ref=cm_cr_arp_d_viewopt_fmt?ie=UTF8&reviewerType=all_reviews&formatType=current_format&pageNumber=3&filterByStar=one_star&sortBy=recent,2024-09-18,UK,,
HP ENVY 6055e,No,Vasari Base,ENVY,Amazon,Canon Pixma TS6420a,2024-09-05,Krista,1,1-2-3-star,Worst printer,Every time I use this printer. I wish I had a hammer nearby so that I could break it.,,Verified Purchase,,Model name: New,0,,,,,https://www.amazon.com/product-reviews/B08XYRVSRT/ref=cm_cr_arp_d_viewopt_fmt?ie=UTF8&reviewerType=all_reviews&formatType=current_format&pageNumber=3&filterByStar=one_star&sortBy=recent,2024-09-18,UK,,
HP ENVY 6055e,No,Vasari Base,ENVY,Amazon,Canon Pixma TS6420a,2024-09-04,Lisa Johnson,1,1-2-3-star,I absolutely despise this printer!,"The set up through HP Smart was a nightmare. In order to sign up for the complete use of the app and Instant Ink, you have to agree to allow HP to share your information with Google and others. I just want to print recipes! If you do not sign up the warranty is one year instead of two.When the printer determines that the ink is low, it stops printing! I unplugged the printer then plugged it back in and was able to print at least 50 more pages before the blue stopped printing. I replaced the color cartridge and tried to print a recipe, nope not allowed. You must replace both cartridges at the same time in order for it to print.There is no longer an LCD screen to show what is happening or why the printer will not print, you must go to the app for all information.If you buy this printer you have absolutely no control over how you use it, HP controls everything. I will never purchase another HP printer in the future, it's not worth aggravation.With that said, the print quality is amazing. I just wish it wasn't so complicated and frustrating to use.",,Verified Purchase,,Model name: New,0,,,,,https://www.amazon.com/product-reviews/B08XYRVSRT/ref=cm_cr_arp_d_viewopt_fmt?ie=UTF8&reviewerType=all_reviews&formatType=current_format&pageNumber=3&filterByStar=one_star&sortBy=recent,2024-09-18,UK,,
HP ENVY 6055e,No,Vasari Base,ENVY,Amazon,Canon Pixma TS6420a,2024-09-04,Jose,1,1-2-3-star,"Can’t feed in paper , will not connect to anything,",Everything. It is junk . Keeps asking for password. What password? So I just tossed this printer in the trash .,,,,Model name: New,0,,,,,https://www.amazon.com/product-reviews/B08XYRVSRT/ref=cm_cr_arp_d_viewopt_fmt?ie=UTF8&reviewerType=all_reviews&formatType=current_format&pageNumber=3&filterByStar=one_star&sortBy=recent,2024-09-18,UK,,
HP ENVY 6055e,No,Vasari Base,ENVY,Amazon,Canon Pixma TS6420a,2024-09-03,woxy,1,1-2-3-star,I hate this printer,"I bought this printer a year ago and it has been the absolute worst purchase. It seemed great at first; it was super easy to connect to my devices to print wirelessly, I liked that I could schedule a print and have it only start once I was near the printer, it was quick and the results great. But this printer will go offline, disconnect, and the lights will go blinking all over the place like a disco and it's impossible to know what the printer is trying to convey with these blinking lights and different colors unless you have the instruction manual by your side and even so, you will be confused. I have a white brick of a disco light show in my office. I have followed all the directions, replaced the ink, filled the paper, gotten the printer back to a steady blue light and as soon as I try to print something the disco dance party will start up again. And don't try to contact CS, you will be on hold for hours and once you reach a person they will essentially read the manual you already read. HATE HATE HATE this printer!",,Verified Purchase,,Model name: New,0,,,,,https://www.amazon.com/product-reviews/B08XYRVSRT/ref=cm_cr_arp_d_viewopt_fmt?ie=UTF8&reviewerType=all_reviews&formatType=current_format&pageNumber=3&filterByStar=one_star&sortBy=recent,2024-09-18,UK,,
HP ENVY 6055e,No,Vasari Base,ENVY,Amazon,Canon Pixma TS6420a,2024-09-03,orangetriangle,1,1-2-3-star,Awful,"I've had it a couple years and it's always a pain to print. The idea of wifi printing is great but it rarely works. There is so much frustrating programming. I print infrequently so it wants me to change the cartridges almost every time because they are old or expired, dried, I don't know. The printer buttons are icons and I never understand what it's conveying to me. I have to use the terrible able and have an account. Would never buy again.",,Verified Purchase,,Model name: New,0,,,,,https://www.amazon.com/product-reviews/B08XYRVSRT/ref=cm_cr_arp_d_viewopt_fmt?ie=UTF8&reviewerType=all_reviews&formatType=current_format&pageNumber=3&filterByStar=one_star&sortBy=recent,2024-09-18,UK,,
HP ENVY 6055e,No,Vasari Base,ENVY,Amazon,Canon Pixma TS6420a,2024-09-03,Amazon Customer,1,1-2-3-star,Stopped working in less than a year,Stopped working within less than a year..Received an E6/E9 error and can't resolve the issue with no help from HP. Many users have experienced this issue as well.,,,,Model name: New,0,,,,,https://www.amazon.com/product-reviews/B08XYRVSRT/ref=cm_cr_arp_d_viewopt_fmt?ie=UTF8&reviewerType=all_reviews&formatType=current_format&pageNumber=3&filterByStar=one_star&sortBy=recent,2024-09-18,UK,,
HP ENVY 6055e,No,Vasari Base,ENVY,Amazon,Canon Pixma TS6420a,2024-09-02,KL,1,1-2-3-star,Will not connect to wifi,This printer would not connect to my wifi after spending 1 hour with a tech no fix . He said call the inteent service provider which then told me he can see the printer on my network but could not get it to connect either . The printer goes though all the steps to connect and on the last step gives an error message. Completely ridiculous that these printers no longer use ethernet cables also . I had to send it back .,,Verified Purchase,,Model name: New,0,,,,,https://www.amazon.com/product-reviews/B08XYRVSRT/ref=cm_cr_arp_d_viewopt_fmt?ie=UTF8&reviewerType=all_reviews&formatType=current_format&pageNumber=4&filterByStar=one_star&sortBy=recent,2024-09-18,UK,,
HP ENVY 6055e,No,Vasari Base,ENVY,Amazon,Canon Pixma TS6420a,2024-08-29,Hades,1,1-2-3-star,Ink Catridge Swindle,"Don't buy unless you are ready to get swindled when it comes to ink cartridges.  Printer runs out of ink in no time,  and every time you replace a cartridge, it carries out  numerous tests,  calibrations that require printing of the calibration results under the pretext of 'ensuring the printer is cobfigured correctly "" This obviously runs down your toner., rinse repeat. Huge huge waste.",,Verified Purchase,,Model name: New,0,,,,,https://www.amazon.com/product-reviews/B08XYRVSRT/ref=cm_cr_arp_d_viewopt_fmt?ie=UTF8&reviewerType=all_reviews&formatType=current_format&pageNumber=4&filterByStar=one_star&sortBy=recent,2024-09-18,UK,,
HP ENVY 6055e,No,Vasari Base,ENVY,Amazon,Canon Pixma TS6420a,2024-08-29,awbuth,1,1-2-3-star,Worst printer I have ever owned. Save yourself a headache and buy a different one,"This printer NEVER works. it is always malfunctioning. I have ink sent by the company (instant ink).... this is also a predatory practice because once you cancel they still send you multiple more months of ink or paper and force you to pay, beware. Anyways, the HP ink is still rejected by the HP printer and it never works.  It is constantly needing to print pages and pages of test papers, wasting said ink and always has an issue. I am so frustrated, having installed and uninstalled the application on the phone.  It is the worst printer I have ever owned in over 20 years of printing.  DO NOT BUY IT and thank me later.",,Verified Purchase,,Model name: New,0,,,,,https://www.amazon.com/product-reviews/B08XYRVSRT/ref=cm_cr_arp_d_viewopt_fmt?ie=UTF8&reviewerType=all_reviews&formatType=current_format&pageNumber=4&filterByStar=one_star&sortBy=recent,2024-09-18,UK,,
HP ENVY 6055e,No,Vasari Base,ENVY,Amazon,Canon Pixma TS6420a,2024-08-28,Jody,1,1-2-3-star,Horrible choice,Very poor print quality.Very small capacity cartridges.Ran out of ink before completing 30 pages.Wireless ONLY. Contrary to the addAll set up must be done on the HP smart app.Forced to enroll in the auto delivery of ink.,,Verified Purchase,,Model name: New,0,,,,,https://www.amazon.com/product-reviews/B08XYRVSRT/ref=cm_cr_arp_d_viewopt_fmt?ie=UTF8&reviewerType=all_reviews&formatType=current_format&pageNumber=4&filterByStar=one_star&sortBy=recent,2024-09-18,UK,,
