Review_Model,Competitor_Flag,HP_Class,Segment,Retailer,Comp_Model,Review_Date,Review_Name,Review_Rating,Review_Title,Review_Content,Seeding_Flag,Verified_Purchase_Flag,Promotion_Flag,Aggregation_Flag,People_Find_Helpful,Syndicated_Source,Response_Date,Response_Text,Response_Name,URL,Scraping_Date,Country,Review_Rating_Label
HP DeskJet 2855e,No,Tassel Base,DeskJet,Amazon,Canon PIXMA TS3520,2024-08-20,TFred,2,not easy to get printing,"The big draw other than the price was the supposedly easy setup and operation. The setup was ok, however, I still have yet to get the printer to print.  I have installed all sorts of of smart features and still cannot get it to work.  The sample page printed fine.  Threw the box out already so the next step is the garbage can.",,Verified Purchase,,Style: New Version,0,,,,,https://www.amazon.com/HP-DeskJet-Wireless-included-588S5A/product-reviews/B0CT2R7199/ref=cm_cr_arp_d_viewopt_fmt?ie=UTF8&reviewerType=all_reviews&formatType=current_format&pageNumber=3&filterByStar=two_star&sortBy=recent,2024-09-21,US,1-2-3-star
HP DeskJet 2855e,No,Tassel Base,DeskJet,Amazon,Canon PIXMA TS3520,2024-08-20,Maddie,2,Just cheap printer,Just cheap printer,,Verified Purchase,,Style: New Version,0,,,,,https://www.amazon.com/HP-DeskJet-Wireless-included-588S5A/product-reviews/B0CT2R7199/ref=cm_cr_arp_d_viewopt_fmt?ie=UTF8&reviewerType=all_reviews&formatType=current_format&pageNumber=3&filterByStar=two_star&sortBy=recent,2024-09-21,US,1-2-3-star
HP DeskJet 2855e,No,Tassel Base,DeskJet,Amazon,Canon PIXMA TS3520,2024-08-18,Jennifer Reisinger,2,Unreliable,The printer worked for 3 months right up until it needed new ink. Now nothing works. It prints half a page. The SmartApp is not user friendly.,,Verified Purchase,,Style: New Version,0,,,,,https://www.amazon.com/HP-DeskJet-Wireless-included-588S5A/product-reviews/B0CT2R7199/ref=cm_cr_arp_d_viewopt_fmt?ie=UTF8&reviewerType=all_reviews&formatType=current_format&pageNumber=3&filterByStar=two_star&sortBy=recent,2024-09-21,US,1-2-3-star
HP DeskJet 2855e,No,Tassel Base,DeskJet,Amazon,Canon PIXMA TS3520,2024-08-18,Stephanie Hill,2,Getting what you pay for....,"The price for this printer is what you get. The ink it came with didn't even work so I had to turn around and order ink right off the get go. (inserting eyeroll)  I was being optimistic thinking I'd found different printer at a cheap price and could get ink that didn't cost more than the printer.  NOTE: I had a Canon TS8120 Pixma printer that died after about 5 years and it was the greatest!! I'll be getting another one this week after finagling with this one for the last 2 weeks.  Granted I do a A LOT of printing since I homeschool and this printer just designed for the amount of printing I do. The amount of ink in the cartridges doesn't last long, it's loud, and likes to only print half of a worksheet every other time. Now, it'd be ideal for someone who prints occasionally. And I thought that purchasing refurbished ink would save a few bucks, but it's a hit or miss if the cartridge actually works on the remanufactured ones.",,Verified Purchase,,Style: New Version,0,,,,,https://www.amazon.com/HP-DeskJet-Wireless-included-588S5A/product-reviews/B0CT2R7199/ref=cm_cr_arp_d_viewopt_fmt?ie=UTF8&reviewerType=all_reviews&formatType=current_format&pageNumber=3&filterByStar=two_star&sortBy=recent,2024-09-21,US,1-2-3-star
HP DeskJet 2855e,No,Tassel Base,DeskJet,Amazon,Canon PIXMA TS3520,2024-08-15,Janet Mercedes Potter,2,Not working for me.,It printed a hand full of pages and hasn’t worked again.,,Verified Purchase,,Style: New Version,0,,,,,https://www.amazon.com/HP-DeskJet-Wireless-included-588S5A/product-reviews/B0CT2R7199/ref=cm_cr_arp_d_viewopt_fmt?ie=UTF8&reviewerType=all_reviews&formatType=current_format&pageNumber=3&filterByStar=two_star&sortBy=recent,2024-09-21,US,1-2-3-star
HP DeskJet 2855e,No,Tassel Base,DeskJet,Amazon,Canon PIXMA TS3520,2024-08-11,Donna Trusty,2,HP Restrictions,I had one of these and it quit working.  I had a couple of cartridges left so thought I would order another one to use ink as it is expensive as the printer.  When I got new one spent two hours getting it to work.  Turns out you must register online (no choice) and must use ONLY Hp genuine ink again no choice.  Other brands will not work!  So now I have two printers close to same model and turns out my daughter had one too that mysteriously quit.  Turns out if you register and use HP ink works fine.  Also wants to auto ship ink.  Felt really scammed by this whole process.  May just invest in another brand because I hate that they have done this.,,Verified Purchase,,Style: New Version,0,,,,,https://www.amazon.com/HP-DeskJet-Wireless-included-588S5A/product-reviews/B0CT2R7199/ref=cm_cr_arp_d_viewopt_fmt?ie=UTF8&reviewerType=all_reviews&formatType=current_format&pageNumber=3&filterByStar=two_star&sortBy=recent,2024-09-21,US,1-2-3-star
HP DeskJet 2855e,No,Tassel Base,DeskJet,Amazon,Canon PIXMA TS3520,2024-08-11,joey ryder,2,Disappointed,Printer works half the time,,Verified Purchase,,Style: New Version,0,,,,,https://www.amazon.com/HP-DeskJet-Wireless-included-588S5A/product-reviews/B0CT2R7199/ref=cm_cr_arp_d_viewopt_fmt?ie=UTF8&reviewerType=all_reviews&formatType=current_format&pageNumber=3&filterByStar=two_star&sortBy=recent,2024-09-21,US,1-2-3-star
HP DeskJet 2855e,No,Tassel Base,DeskJet,Amazon,Canon PIXMA TS3520,2024-08-10,Kaity,2,Connection issues… very frequently,"I hate this printer. The connection issues are frustrating. It will work great for a few weeks and then I have issues with it. I’ll try to print from my phone and nothing will print, then I try to use the HP smart app and it will say that my printer is busy. I’ve tried unplugging, hitting the X button.. nothing. Then I’ll give up and just not use it again for a while.",,,,Style: New Version,0,,,,,https://www.amazon.com/HP-DeskJet-Wireless-included-588S5A/product-reviews/B0CT2R7199/ref=cm_cr_arp_d_viewopt_fmt?ie=UTF8&reviewerType=all_reviews&formatType=current_format&pageNumber=3&filterByStar=two_star&sortBy=recent,2024-09-21,US,1-2-3-star
HP DeskJet 2855e,No,Tassel Base,DeskJet,Amazon,Canon PIXMA TS3520,2024-08-10,Jane,2,Stay away from the ink subscription,"The printer itself is okay. Nothing special. But I made the mistake of subscribing to their ink cartridge program. Big mistake. You pay so much a month depending on how many pages you print. If you sign up for 10 pages a month @$2 a month and go over that amount, you're charged $1 per page. Of course the amount of unused pages doesn't carry over to the next month, so if you print zero for three months-- and are charged $6, and the next month print 20 pages, you'll be charged $10 for the extra pages!  Worst of all, if you unsubscribe, the printer won't work on the cartridges you've already paid for!  You're forced to continue ""subscribing."" Beware. Just buy ink from Amazon.",,,,Style: New Version,0,,,,,https://www.amazon.com/HP-DeskJet-Wireless-included-588S5A/product-reviews/B0CT2R7199/ref=cm_cr_arp_d_viewopt_fmt?ie=UTF8&reviewerType=all_reviews&formatType=current_format&pageNumber=3&filterByStar=two_star&sortBy=recent,2024-09-21,US,1-2-3-star
HP DeskJet 2855e,No,Tassel Base,DeskJet,Amazon,Canon PIXMA TS3520,2024-08-09,Michael,2,wireless printing capabilities are absolutely trash,"Print quality is fine, fast and with the usual downsides (expensive ink cartridges, about 15-20 cents per page). I do appreciate the support for single-black-cartridge mode, to avoid wasting color ink on ""fancy grayscale"" print settings (we don't need color printing anyway).Scan and copy functionality is fine.However, dealing with getting the printer to actually run a print job is infuriating. Over a Wi-Fi connection from my Windows 11 computer, trying to print something NEVER works the first time. I also have the HP Smart app installed but there is never any error message that shows up there. I have definitely updated all drivers, firmware, Windows updates, etc. It usually takes me about 20-30 minutes of troubleshooting with several of the below strategies (wasting time and extra test pages and ink) before I can finally get something to print:- printer does not wake from sleep mode, need to push power button to do so- restart printer by turning off and on- turn printer's wireless connection off and on using the Wi-Fi button- try printing a test page from Windows settings- try running the Windows troubleshooter- ""retry"" option in the Windows print queue- delete job from print queue and print the document again- remove printer from Windows list of devices and add it againAfter consistently dealing with this for over a year I finally decided to give up and purchase a USB-B cable to print using a wired connection. I have not tried this yet, hopefully it works, but I really wouldn't be surprised if it doesn't.I have had other HP printers in the past and they absolutely do not have so many problems with receiving jobs. This is probably just a crappy product line.",,,,Style: New Version,0,,,,,https://www.amazon.com/HP-DeskJet-Wireless-included-588S5A/product-reviews/B0CT2R7199/ref=cm_cr_arp_d_viewopt_fmt?ie=UTF8&reviewerType=all_reviews&formatType=current_format&pageNumber=4&filterByStar=two_star&sortBy=recent,2024-09-21,US,1-2-3-star
HP DeskJet 2855e,No,Tassel Base,DeskJet,Amazon,Canon PIXMA TS3520,2024-08-09,Liana Nunziato,2,DO NOT BUY,"Update:You have to print through the HP Smart app. In other words, if you are on a website or file and click print and select the printer it will not work. If you are on a website or file and you select print with HP Smart App it will not work. You have to go into the app and open the file in order to print——I purchased this printer thinking it would be an affordable option when I only need to print a couple items on a rare occasion.First con, on setup the app wants you to have a subscription to monitor your ink usage and send you ink refills. The subscription is not worth it when you are printing only a couple things every few weeks. I declined it which may be the real issue behind the next issue.Second it is almost impossible to send documents to this printer on any device. The app on my phone, which says the printer is available and ready, will quickly get an error anytime you send something saying you don’t have paper loaded when you do or some other error like the printer is now offline.I wish that I hadn’t gotten this printer at all and invested in something from another company.",,Verified Purchase,,Style: New Version,0,,,,,https://www.amazon.com/HP-DeskJet-Wireless-included-588S5A/product-reviews/B0CT2R7199/ref=cm_cr_arp_d_viewopt_fmt?ie=UTF8&reviewerType=all_reviews&formatType=current_format&pageNumber=4&filterByStar=two_star&sortBy=recent,2024-09-21,US,1-2-3-star
HP DeskJet 2855e,No,Tassel Base,DeskJet,Amazon,Canon PIXMA TS3520,2024-08-05,Carole Warner,2,Buyer beware!  This printer ONLY sets up and works wirelessly on a 2G internet speed.,"If you have 5G internet speed, you are out of luck.  You can only use the printer with a USB cable, without the wireless function and without the 3 month ink supply offer because you cannot set it up per the enclosed instructions. You can only get the ink offer if you set it up wirelessly which you cannot do if you don't have a 2G (old) connection.  I opened the ink cartridges before discovering this unfortunate fact so could no longer return the printer. Total waste of money!",,Verified Purchase,,Style: New Version,0,,,,,https://www.amazon.com/HP-DeskJet-Wireless-included-588S5A/product-reviews/B0CT2R7199/ref=cm_cr_arp_d_viewopt_fmt?ie=UTF8&reviewerType=all_reviews&formatType=current_format&pageNumber=4&filterByStar=two_star&sortBy=recent,2024-09-21,US,1-2-3-star
HP DeskJet 2855e,No,Tassel Base,DeskJet,Amazon,Canon PIXMA TS3520,2024-08-05,Christine B,2,Terrible,Terrible printer. Purchased 2 of them. Both had problems working. Returned them both.,,Verified Purchase,,Style: New Version,0,,,,,https://www.amazon.com/HP-DeskJet-Wireless-included-588S5A/product-reviews/B0CT2R7199/ref=cm_cr_arp_d_viewopt_fmt?ie=UTF8&reviewerType=all_reviews&formatType=current_format&pageNumber=4&filterByStar=two_star&sortBy=recent,2024-09-21,US,1-2-3-star
HP DeskJet 2855e,No,Tassel Base,DeskJet,Amazon,Canon PIXMA TS3520,2024-08-03,Rick,2,Not working after few weeks,Rollers started sticking the paper wrong directions and do not know how to fix but for a new printer shouldn’t have that problem,,Verified Purchase,,Style: New Version,0,,,,,https://www.amazon.com/HP-DeskJet-Wireless-included-588S5A/product-reviews/B0CT2R7199/ref=cm_cr_arp_d_viewopt_fmt?ie=UTF8&reviewerType=all_reviews&formatType=current_format&pageNumber=4&filterByStar=two_star&sortBy=recent,2024-09-21,US,1-2-3-star
HP DeskJet 2855e,No,Tassel Base,DeskJet,Amazon,Canon PIXMA TS3520,2024-08-03,Isaac Villasenor,2,Amazon buy,Scanner sucks and connections horrible only good for printing got to have a compatible wifi for Bluetooth to work can't be to high,,Verified Purchase,,Style: New Version,0,,,,,https://www.amazon.com/HP-DeskJet-Wireless-included-588S5A/product-reviews/B0CT2R7199/ref=cm_cr_arp_d_viewopt_fmt?ie=UTF8&reviewerType=all_reviews&formatType=current_format&pageNumber=4&filterByStar=two_star&sortBy=recent,2024-09-21,US,1-2-3-star
HP DeskJet 2855e,No,Tassel Base,DeskJet,Amazon,Canon PIXMA TS3520,2024-08-03,momsquam,2,wireless printer,"I returned this printer.  I do not need an expensive high quality printer. I do want a printer that is easy to use and prints fairly decent.  I didn't find this printer to be 'easy' to set up but wasn't horrible.  It did become a nightmare to print anything after the set up.  I have a mac book, and an iphone.  Everytime I tried to print from any device I had to power the printer down and restart it.  When it does print its fairly slow, but prints a decent copy.",,Verified Purchase,,Style: New Version,0,,,,,https://www.amazon.com/HP-DeskJet-Wireless-included-588S5A/product-reviews/B0CT2R7199/ref=cm_cr_arp_d_viewopt_fmt?ie=UTF8&reviewerType=all_reviews&formatType=current_format&pageNumber=4&filterByStar=two_star&sortBy=recent,2024-09-21,US,1-2-3-star
HP DeskJet 2855e,No,Tassel Base,DeskJet,Amazon,Canon PIXMA TS3520,2024-08-02,Rachelle L,2,Paper holder broke,"This printer was so hard to get compatible with a Mac. The app you have to download seems like it keeps asking you to long in no matter what settings you click or opens ups a browser that is deemed “unsafe”. The AirPrint wireless print is not intuitive, I had to try several times to sync to the printer network just to print form my laptop since it refused to print while it was on the same network as me. The paper holder back tray also popped of while unboxing so be extremely gentle. We were fed up with our other printer and this one is almost worse to just get an easy set up to print.",,Verified Purchase,,Style: New Version,0,,,,,https://www.amazon.com/HP-DeskJet-Wireless-included-588S5A/product-reviews/B0CT2R7199/ref=cm_cr_arp_d_viewopt_fmt?ie=UTF8&reviewerType=all_reviews&formatType=current_format&pageNumber=4&filterByStar=two_star&sortBy=recent,2024-09-21,US,1-2-3-star
HP DeskJet 2855e,No,Tassel Base,DeskJet,Amazon,Canon PIXMA TS3520,2024-08-02,Elizondo,2,Wifi,I had a hard time setting it up. I don't like the wireless connection,,Verified Purchase,,Style: New Version,0,,,,,https://www.amazon.com/HP-DeskJet-Wireless-included-588S5A/product-reviews/B0CT2R7199/ref=cm_cr_arp_d_viewopt_fmt?ie=UTF8&reviewerType=all_reviews&formatType=current_format&pageNumber=4&filterByStar=two_star&sortBy=recent,2024-09-21,US,1-2-3-star
HP DeskJet 2855e,No,Tassel Base,DeskJet,Amazon,Canon PIXMA TS3520,2024-08-01,mom review,2,Why,"I have set it up. It printed from my phone. I tried to print from my MAC but MAC, which has found every printer from the past, can't seem to find this one.It's a sleek & pretty clean design, but even when I tried to print from my phone the next day, it became too much of a 'project', as it wasn't working.I will try again in a few days when I am more patient, and maybe I'll change this review.",,Verified Purchase,,Style: New Version,0,,,,,https://www.amazon.com/HP-DeskJet-Wireless-included-588S5A/product-reviews/B0CT2R7199/ref=cm_cr_arp_d_viewopt_fmt?ie=UTF8&reviewerType=all_reviews&formatType=current_format&pageNumber=4&filterByStar=two_star&sortBy=recent,2024-09-21,US,1-2-3-star
HP DeskJet 2855e,No,Tassel Base,DeskJet,Amazon,Canon PIXMA TS3520,2024-08-01,Doris Eldridge,2,worst,worst printer I ever bought,,Verified Purchase,,Style: New Version,0,,,,,https://www.amazon.com/HP-DeskJet-Wireless-included-588S5A/product-reviews/B0CT2R7199/ref=cm_cr_arp_d_viewopt_fmt?ie=UTF8&reviewerType=all_reviews&formatType=current_format&pageNumber=5&filterByStar=two_star&sortBy=recent,2024-09-21,US,1-2-3-star
HP DeskJet 2855e,No,Tassel Base,DeskJet,Amazon,Canon PIXMA TS3520,2024-07-30,Nina,2,Meh,"Constantly disconnects, never wakes up to print, doesn’t have double sided print options…I’m so disappointed!!",,Verified Purchase,,Style: New Version,0,,,,,https://www.amazon.com/HP-DeskJet-Wireless-included-588S5A/product-reviews/B0CT2R7199/ref=cm_cr_arp_d_viewopt_fmt?ie=UTF8&reviewerType=all_reviews&formatType=current_format&pageNumber=5&filterByStar=two_star&sortBy=recent,2024-09-21,US,1-2-3-star
HP DeskJet 2855e,No,Tassel Base,DeskJet,Amazon,Canon PIXMA TS3520,2024-07-29,Emma,2,Not the best,"Really not the best printer, even for the price. I can only get it to print in color from their stupid app, which is beyond annoying. It feels like it uses a lot more ink than other printers I've had as well. I guess it works for the most part though, but I can't say I'd recommend getting it.",,Verified Purchase,,Style: New Version,0,,,,,https://www.amazon.com/HP-DeskJet-Wireless-included-588S5A/product-reviews/B0CT2R7199/ref=cm_cr_arp_d_viewopt_fmt?ie=UTF8&reviewerType=all_reviews&formatType=current_format&pageNumber=5&filterByStar=two_star&sortBy=recent,2024-09-21,US,1-2-3-star
HP DeskJet 2855e,No,Tassel Base,DeskJet,Amazon,Canon PIXMA TS3520,2024-07-28,Lady Blue,2,My worst purchase ever!,Printing is not up to par!  Doesn't hold enough paper and and I constantly have to deal with faded color copies of paperwork.  I miss my old HP printer and this needs to go back....total waste of money!,,Verified Purchase,,Style: New Version,0,,,,,https://www.amazon.com/HP-DeskJet-Wireless-included-588S5A/product-reviews/B0CT2R7199/ref=cm_cr_arp_d_viewopt_fmt?ie=UTF8&reviewerType=all_reviews&formatType=current_format&pageNumber=5&filterByStar=two_star&sortBy=recent,2024-09-21,US,1-2-3-star
HP DeskJet 2855e,No,Tassel Base,DeskJet,Amazon,Canon PIXMA TS3520,2024-07-28,crivera,2,Printer was easy to setup. Thats about the end of the positive.,"Otherwise, this printer is just good enough to use, and just bad enough to hate it every time you try and use it. This printer is very finicky and does not always print the document or will print out a blank page. I regret not splurging for a higher quality printer. Also the printer showed up with 1/2 empty ink cartridges. I would have returned it but the return window was too small to realize these issues.",,Verified Purchase,,Style: New Version,0,,,,,https://www.amazon.com/HP-DeskJet-Wireless-included-588S5A/product-reviews/B0CT2R7199/ref=cm_cr_arp_d_viewopt_fmt?ie=UTF8&reviewerType=all_reviews&formatType=current_format&pageNumber=5&filterByStar=two_star&sortBy=recent,2024-09-21,US,1-2-3-star
HP DeskJet 2855e,No,Tassel Base,DeskJet,Amazon,Canon PIXMA TS3520,2024-07-27,Midiala Rodriguez,2,La tinta que trae solo dura 5 o 6 copias,La tinta que trae incluida no dura nada solo 5 o 6 copias,,Verified Purchase,,Style: New Version,0,,,,,https://www.amazon.com/HP-DeskJet-Wireless-included-588S5A/product-reviews/B0CT2R7199/ref=cm_cr_arp_d_viewopt_fmt?ie=UTF8&reviewerType=all_reviews&formatType=current_format&pageNumber=5&filterByStar=two_star&sortBy=recent,2024-09-21,US,1-2-3-star
HP DeskJet 2855e,No,Tassel Base,DeskJet,Amazon,Canon PIXMA TS3520,2024-07-26,Samantha E,2,Set Up Process Frustrating,"They will hound you to activate and enroll in HP+ during the set up process. It’s beyond annoying, I do not need another pointless account to keep track of just so I can print something 3-4 times a year.",,Verified Purchase,,Style: New Version,0,,,,,https://www.amazon.com/HP-DeskJet-Wireless-included-588S5A/product-reviews/B0CT2R7199/ref=cm_cr_arp_d_viewopt_fmt?ie=UTF8&reviewerType=all_reviews&formatType=current_format&pageNumber=5&filterByStar=two_star&sortBy=recent,2024-09-21,US,1-2-3-star
HP DeskJet 2855e,No,Tassel Base,DeskJet,Amazon,Canon PIXMA TS3520,2024-07-25,Lucy B,2,Does not work wirelessly all the time,"I purchased it to send my work wirelessly via my phone, and 80 % of the time is not working.Also paper jams often.",,Verified Purchase,,Style: New Version,0,,,,,https://www.amazon.com/HP-DeskJet-Wireless-included-588S5A/product-reviews/B0CT2R7199/ref=cm_cr_arp_d_viewopt_fmt?ie=UTF8&reviewerType=all_reviews&formatType=current_format&pageNumber=5&filterByStar=two_star&sortBy=recent,2024-09-21,US,1-2-3-star
HP DeskJet 2855e,No,Tassel Base,DeskJet,Amazon,Canon PIXMA TS3520,2024-07-25,Anthony D'Alessio,2,Sadly disapointed,In todays techy world HP lacks how to actually connect wirelessly.  The company bought this and is going to keep it but we had to buy cables to plug it in since it only connects to 2.4Gz wireless connection.  Our tech department along with HP tried everything to get it to connect wirelessly and no go...  Even the Best Buys guys said that this was a common HP issue.  Very sad to see HP doing so horrible in this wireless world!,,Verified Purchase,,Style: New Version,0,,,,,https://www.amazon.com/HP-DeskJet-Wireless-included-588S5A/product-reviews/B0CT2R7199/ref=cm_cr_arp_d_viewopt_fmt?ie=UTF8&reviewerType=all_reviews&formatType=current_format&pageNumber=5&filterByStar=two_star&sortBy=recent,2024-09-21,US,1-2-3-star
HP DeskJet 2855e,No,Tassel Base,DeskJet,Amazon,Canon PIXMA TS3520,2024-07-25,N.E.,2,Horrible set up process.,"We've been spending the last 3 hours trying to get this seemingly basic printer to work. We finally got it going and now can't get it to work again. Constant errors. If it's not one thing, it's another. I don't recommend this garbage at all. Considering HP is a well known company with otherwise useful products, this isn't one of them. Probably will end up returning it. We bought this because it was on sale, and now we can see why. Won't be buying another printer like it and will absolutely go to a different company that can have reliable equipment and not some cheap piece of trash with faulty set ups and bad connection. Go ahead and spend the extra money on something else that works. Cheap = worthless.",,Verified Purchase,,Style: New Version,0,,,,,https://www.amazon.com/HP-DeskJet-Wireless-included-588S5A/product-reviews/B0CT2R7199/ref=cm_cr_arp_d_viewopt_fmt?ie=UTF8&reviewerType=all_reviews&formatType=current_format&pageNumber=5&filterByStar=two_star&sortBy=recent,2024-09-21,US,1-2-3-star
HP DeskJet 2855e,No,Tassel Base,DeskJet,Amazon,Canon PIXMA TS3520,2024-09-17,LUCINDA GUILLOT,3,Do not buy!,The printer works great; but it is almost impossible to find replacement ink cartridges unless you go through their own very expensive monthly program. I have had so many HP printers in the past and was so pleased until they sneakily made it impossible to buy a replacement ink cartridge other than their own brand. I had to send back 5 different replacement ink cartridges to Amazon that were advertised to work with this new printer. I can’t wait to replace this inconvenient printer. Never again will I go with HP!,,Verified Purchase,,Style: New Version,0,,,,,https://www.amazon.com/HP-DeskJet-Wireless-included-588S5A/product-reviews/B0CT2R7199/ref=cm_cr_arp_d_viewopt_fmt?ie=UTF8&reviewerType=all_reviews&formatType=current_format&pageNumber=1&filterByStar=three_star&sortBy=recent,2024-09-21,US,1-2-3-star
HP DeskJet 2855e,No,Tassel Base,DeskJet,Amazon,Canon PIXMA TS3520,2024-09-14,Jeannetta,3,Good product Ink goes Very fast,"Good price for a decent print quality however, the end goes extremely fast and is expensive to replace",,Verified Purchase,,Style: New Version,0,,,,,https://www.amazon.com/HP-DeskJet-Wireless-included-588S5A/product-reviews/B0CT2R7199/ref=cm_cr_arp_d_viewopt_fmt?ie=UTF8&reviewerType=all_reviews&formatType=current_format&pageNumber=1&filterByStar=three_star&sortBy=recent,2024-09-21,US,1-2-3-star
HP DeskJet 2855e,No,Tassel Base,DeskJet,Amazon,Canon PIXMA TS3520,2024-09-07,T,3,Printing,"Everything is good especially the delivery. However, while printing, the printer itself is super slow but, color ink and black ink works perfectly",,Verified Purchase,,Style: New Version,0,,,,,https://www.amazon.com/HP-DeskJet-Wireless-included-588S5A/product-reviews/B0CT2R7199/ref=cm_cr_arp_d_viewopt_fmt?ie=UTF8&reviewerType=all_reviews&formatType=current_format&pageNumber=1&filterByStar=three_star&sortBy=recent,2024-09-21,US,1-2-3-star
HP DeskJet 2855e,No,Tassel Base,DeskJet,Amazon,Canon PIXMA TS3520,2024-09-03,Amazon Customer,3,NO FREE INK,"NO 3 MONTHS FREE INK. Cartridges included are ONLY FOR SETUP. So, enough for 8 or so pages.MONTHLY FEE for FREE INK,  auto delivery on ink every 3 months. Lots of problems with set up.3.5 hoursThen, call you back in 24 hours.Shop around. Read fine print. Read everything.",,Verified Purchase,,Style: New Version,0,,,,,https://www.amazon.com/HP-DeskJet-Wireless-included-588S5A/product-reviews/B0CT2R7199/ref=cm_cr_arp_d_viewopt_fmt?ie=UTF8&reviewerType=all_reviews&formatType=current_format&pageNumber=1&filterByStar=three_star&sortBy=recent,2024-09-21,US,1-2-3-star
