Review_Model,Competitor_Flag,HP_Class,Segment,Retailer,Comp_Model,Review_Date,Review_Name,Review_Rating,Review_Title,Review_Content,Seeding_Flag,Verified_Purchase_Flag,Promotion_Flag,Aggregation_Flag,People_Find_Helpful,Syndicated_Source,Response_Date,Response_Text,Response_Name,URL,Scraping_Date,Country,Review_Rating_Label
HP DeskJet 2855e,No,Tassel Base,DeskJet,Amazon,Canon PIXMA TS3520,2024-07-27,NateJr,3,Printer,"Good for the price, easy to use.",,Verified Purchase,,Style: New Version,0,,,,,https://www.amazon.com/HP-DeskJet-Wireless-included-588S5A/product-reviews/B0CT2R7199/ref=cm_cr_arp_d_viewopt_fmt?ie=UTF8&reviewerType=all_reviews&formatType=current_format&pageNumber=5&filterByStar=three_star&sortBy=recent,2024-09-21,US,1-2-3-star
HP DeskJet 2855e,No,Tassel Base,DeskJet,Amazon,Canon PIXMA TS3520,2024-07-26,Sandstorm,3,Out of ink already,"The price of the printer was great, but sometimes you get what you pay for.  I am know out of color ink so quickly.  I  signed up for instant ink and really need color ink now!",,Verified Purchase,,Style: New Version,0,,,,,https://www.amazon.com/HP-DeskJet-Wireless-included-588S5A/product-reviews/B0CT2R7199/ref=cm_cr_arp_d_viewopt_fmt?ie=UTF8&reviewerType=all_reviews&formatType=current_format&pageNumber=5&filterByStar=three_star&sortBy=recent,2024-09-21,US,1-2-3-star
HP DeskJet 2855e,No,Tassel Base,DeskJet,Amazon,Canon PIXMA TS3520,2024-07-26,Catherine L Juve,3,The 3 month supply of free ink lasted 2 days!,"Tricky to get printer to scan.  I had to get help from a computer expert.  Also, the advertised 3 months of free ink lasted just 2 days after printer approximately 20 pages.  Not such a great deal considering the price of the ink!",,Verified Purchase,,Style: New Version,0,,,,,https://www.amazon.com/HP-DeskJet-Wireless-included-588S5A/product-reviews/B0CT2R7199/ref=cm_cr_arp_d_viewopt_fmt?ie=UTF8&reviewerType=all_reviews&formatType=current_format&pageNumber=5&filterByStar=three_star&sortBy=recent,2024-09-21,US,1-2-3-star
HP DeskJet 2855e,No,Tassel Base,DeskJet,Amazon,Canon PIXMA TS3520,2024-07-25,Jennie Hensey,3,Hp printer,I disliked the fact the the printer ink cartridges were no good. So as far as a review wasn’t happy!  Instant cartriage error tried putting cartridge in and out trouble shooting did everything except buy new ink,,Verified Purchase,,Style: New Version,0,,,,,https://www.amazon.com/HP-DeskJet-Wireless-included-588S5A/product-reviews/B0CT2R7199/ref=cm_cr_arp_d_viewopt_fmt?ie=UTF8&reviewerType=all_reviews&formatType=current_format&pageNumber=5&filterByStar=three_star&sortBy=recent,2024-09-21,US,1-2-3-star
HP DeskJet 2855e,No,Tassel Base,DeskJet,Amazon,Canon PIXMA TS3520,2024-07-24,Deborah A. Bishop,3,2.4 GHz limitation unsuitable,We dangle 50+ devices off our 5GHz WiFi. This printer can’t do 5GHz and we can’t accommodate using an alternative 2.4 GHz WiFi.Otherwise liked the printer even with $4.99/month ink fee.,,Verified Purchase,,Style: New Version,0,,,,,https://www.amazon.com/HP-DeskJet-Wireless-included-588S5A/product-reviews/B0CT2R7199/ref=cm_cr_arp_d_viewopt_fmt?ie=UTF8&reviewerType=all_reviews&formatType=current_format&pageNumber=5&filterByStar=three_star&sortBy=recent,2024-09-21,US,1-2-3-star
HP DeskJet 2855e,No,Tassel Base,DeskJet,Amazon,Canon PIXMA TS3520,2024-07-23,Cathlin,3,Printing time,Very slow to print,,Verified Purchase,,Style: New Version,0,,,,,https://www.amazon.com/HP-DeskJet-Wireless-included-588S5A/product-reviews/B0CT2R7199/ref=cm_cr_arp_d_viewopt_fmt?ie=UTF8&reviewerType=all_reviews&formatType=current_format&pageNumber=5&filterByStar=three_star&sortBy=recent,2024-09-21,US,1-2-3-star
HP DeskJet 2855e,No,Tassel Base,DeskJet,Amazon,Canon PIXMA TS3520,2024-07-23,gi,3,It’s ok,"I personally don’t like printers, either they eat the paper, stop working, ink dries out, or doesn’t connect. This one so far is ok. I had to turn in on and off a couple of times to get it to reconnect to print. But mechanically it’s good. Set up took a few trouble shooting issues. It couldn’t find it. I know there’s a lot of factors.",,Verified Purchase,,Style: New Version,0,,,,,https://www.amazon.com/HP-DeskJet-Wireless-included-588S5A/product-reviews/B0CT2R7199/ref=cm_cr_arp_d_viewopt_fmt?ie=UTF8&reviewerType=all_reviews&formatType=current_format&pageNumber=5&filterByStar=three_star&sortBy=recent,2024-09-21,US,1-2-3-star
HP DeskJet 2855e,No,Tassel Base,DeskJet,Amazon,Canon PIXMA TS3520,2024-07-23,Jessica,3,No black ink,"So i received this printer and it just shows error code E0 which means cartridge low or not there well i tried everything and no luck! Frustrating, new in box and no ink? Upsetting.",,Verified Purchase,,Style: New Version,0,,,,,https://www.amazon.com/HP-DeskJet-Wireless-included-588S5A/product-reviews/B0CT2R7199/ref=cm_cr_arp_d_viewopt_fmt?ie=UTF8&reviewerType=all_reviews&formatType=current_format&pageNumber=5&filterByStar=three_star&sortBy=recent,2024-09-21,US,1-2-3-star
HP DeskJet 2855e,No,Tassel Base,DeskJet,Amazon,Canon PIXMA TS3520,2024-09-16,King2.0,4,I do recommend it,Work great,,Verified Purchase,,Style: New Version,0,,,,,https://www.amazon.com/HP-DeskJet-Wireless-included-588S5A/product-reviews/B0CT2R7199/ref=cm_cr_arp_d_viewopt_fmt?ie=UTF8&reviewerType=all_reviews&formatType=current_format&pageNumber=1&filterByStar=four_star&sortBy=recent,2024-09-21,US,4-5-star
HP DeskJet 2855e,No,Tassel Base,DeskJet,Amazon,Canon PIXMA TS3520,2024-09-16,P.B.,4,Nice little copier.,"I just recently set it up. Nice size, looks good and easy to set up. Picture quality is good. Like the auto set up for ink delivery.",,Verified Purchase,,Style: New Version,0,,,,,https://www.amazon.com/HP-DeskJet-Wireless-included-588S5A/product-reviews/B0CT2R7199/ref=cm_cr_arp_d_viewopt_fmt?ie=UTF8&reviewerType=all_reviews&formatType=current_format&pageNumber=1&filterByStar=four_star&sortBy=recent,2024-09-21,US,4-5-star
HP DeskJet 2855e,No,Tassel Base,DeskJet,Amazon,Canon PIXMA TS3520,2024-09-16,Sharon Flora,4,That the product works,It worked just like it was supposed to. I got to use it for the reason that I wanted it.,,Verified Purchase,,Style: New Version,0,,,,,https://www.amazon.com/HP-DeskJet-Wireless-included-588S5A/product-reviews/B0CT2R7199/ref=cm_cr_arp_d_viewopt_fmt?ie=UTF8&reviewerType=all_reviews&formatType=current_format&pageNumber=1&filterByStar=four_star&sortBy=recent,2024-09-21,US,4-5-star
HP DeskJet 2855e,No,Tassel Base,DeskJet,Amazon,Canon PIXMA TS3520,2024-09-13,Momofthree,4,Can’t print double sides,Great printer. The one issue I have which is why it lost a star is that I can’t print double sided. Otherwise I love HP’s ink program. It was very easy to set up and get started. Not super noisy. And when I need more ink it ships to my house so I don’t have to worry about running out. But I’m not a big printer I just print here and there.,,Verified Purchase,,Style: New Version,0,,,,,https://www.amazon.com/HP-DeskJet-Wireless-included-588S5A/product-reviews/B0CT2R7199/ref=cm_cr_arp_d_viewopt_fmt?ie=UTF8&reviewerType=all_reviews&formatType=current_format&pageNumber=1&filterByStar=four_star&sortBy=recent,2024-09-21,US,4-5-star
HP DeskJet 2855e,No,Tassel Base,DeskJet,Amazon,Canon PIXMA TS3520,2024-09-11,Amazon Customer,4,Works,Received printer the black Ink was dry and printer wouldn’t work. Contacted Amazon they helped me talk with HP in which after HP sent a new black ink cartridge. All in all works well now.,,Verified Purchase,,Style: New Version,0,,,,,https://www.amazon.com/HP-DeskJet-Wireless-included-588S5A/product-reviews/B0CT2R7199/ref=cm_cr_arp_d_viewopt_fmt?ie=UTF8&reviewerType=all_reviews&formatType=current_format&pageNumber=1&filterByStar=four_star&sortBy=recent,2024-09-21,US,4-5-star
HP DeskJet 2855e,No,Tassel Base,DeskJet,Amazon,Canon PIXMA TS3520,2024-09-05,Larry E Ganger,4,"This was a gift, not for my use.","As I stated above, this was a gift for someone, not for personal use. But the party said it was working fine.",,Verified Purchase,,Style: New Version,0,,,,,https://www.amazon.com/HP-DeskJet-Wireless-included-588S5A/product-reviews/B0CT2R7199/ref=cm_cr_arp_d_viewopt_fmt?ie=UTF8&reviewerType=all_reviews&formatType=current_format&pageNumber=1&filterByStar=four_star&sortBy=recent,2024-09-21,US,4-5-star
HP DeskJet 2855e,No,Tassel Base,DeskJet,Amazon,Canon PIXMA TS3520,2024-09-04,Heather Etherton,4,Ease of use!,"Use for at home printing. Love the ability to print from anywhere in my home. When connected to WiFi it works great and is easy to use, but if you lose your connection to WiFi it can be frustrating to reconnect. Not impossible, but takes some troubleshooting sometimes. Tech support it great though!",,Verified Purchase,,Style: New Version,2,,,,,https://www.amazon.com/HP-DeskJet-Wireless-included-588S5A/product-reviews/B0CT2R7199/ref=cm_cr_arp_d_viewopt_fmt?ie=UTF8&reviewerType=all_reviews&formatType=current_format&pageNumber=1&filterByStar=four_star&sortBy=recent,2024-09-21,US,4-5-star
HP DeskJet 2855e,No,Tassel Base,DeskJet,Amazon,Canon PIXMA TS3520,2024-09-03,dshetts,4,Tricky setup,"Product works great. Setup up was quite difficult when not trying to agree to the yearly ink contract. Finally got it after about an hour. Prints fast and also know NOT USB, ONLY WIFI. Setup was tricky but doable. Also the size was perfect.",,Verified Purchase,,Style: New Version,0,,,,,https://www.amazon.com/HP-DeskJet-Wireless-included-588S5A/product-reviews/B0CT2R7199/ref=cm_cr_arp_d_viewopt_fmt?ie=UTF8&reviewerType=all_reviews&formatType=current_format&pageNumber=1&filterByStar=four_star&sortBy=recent,2024-09-21,US,4-5-star
HP DeskJet 2855e,No,Tassel Base,DeskJet,Amazon,Canon PIXMA TS3520,2024-08-29,Diana Wright,4,Easy setup and use,"I wanted a home printer, nothing expensive. This fit the bill. It was easy to connect to internet and start using. You get 3 months of ink free.  I also got paper for another 1.99.I’ll probably cancel the ink refill after the freebie expires. I don’t print that much. Other people have said the printer stops working after they cancel the free months of ink. They want you to buy the ink from them.",,Verified Purchase,,Style: New Version,0,,,,,https://www.amazon.com/HP-DeskJet-Wireless-included-588S5A/product-reviews/B0CT2R7199/ref=cm_cr_arp_d_viewopt_fmt?ie=UTF8&reviewerType=all_reviews&formatType=current_format&pageNumber=1&filterByStar=four_star&sortBy=recent,2024-09-21,US,4-5-star
HP DeskJet 2855e,No,Tassel Base,DeskJet,Amazon,Canon PIXMA TS3520,2024-08-28,John and Cynthia Stinson,4,Good for Home Office,Has worked out great. Took a little time as this model does not allow for Ethernet cable connection (WIFI Only)I downloaded scanner app and all was good,,Verified Purchase,,Style: New Version,0,,,,,https://www.amazon.com/HP-DeskJet-Wireless-included-588S5A/product-reviews/B0CT2R7199/ref=cm_cr_arp_d_viewopt_fmt?ie=UTF8&reviewerType=all_reviews&formatType=current_format&pageNumber=1&filterByStar=four_star&sortBy=recent,2024-09-21,US,4-5-star
HP DeskJet 2855e,No,Tassel Base,DeskJet,Amazon,Canon PIXMA TS3520,2024-08-28,M.D.C,4,Usability and Durability.,Great value for the money.  However the ink cartridges are tiny and I don't think each will allow very much printing before re-ordering more ink .,,Verified Purchase,,Style: New Version,0,,,,,https://www.amazon.com/HP-DeskJet-Wireless-included-588S5A/product-reviews/B0CT2R7199/ref=cm_cr_arp_d_viewopt_fmt?ie=UTF8&reviewerType=all_reviews&formatType=current_format&pageNumber=2&filterByStar=four_star&sortBy=recent,2024-09-21,US,4-5-star
HP DeskJet 2855e,No,Tassel Base,DeskJet,Amazon,Canon PIXMA TS3520,2024-08-28,Rachel,4,Nice,We love it.,,Verified Purchase,,Style: New Version,0,,,,,https://www.amazon.com/HP-DeskJet-Wireless-included-588S5A/product-reviews/B0CT2R7199/ref=cm_cr_arp_d_viewopt_fmt?ie=UTF8&reviewerType=all_reviews&formatType=current_format&pageNumber=2&filterByStar=four_star&sortBy=recent,2024-09-21,US,4-5-star
HP DeskJet 2855e,No,Tassel Base,DeskJet,Amazon,Canon PIXMA TS3520,2024-08-27,Breslin McKenna,4,It’s easy to connect,It was easy to connect and use - wish there were a little morning that goes with the printer because u don’t want to buy any u til u know it works well - but otherwise a decent printer,,Verified Purchase,,Style: New Version,0,,,,,https://www.amazon.com/HP-DeskJet-Wireless-included-588S5A/product-reviews/B0CT2R7199/ref=cm_cr_arp_d_viewopt_fmt?ie=UTF8&reviewerType=all_reviews&formatType=current_format&pageNumber=2&filterByStar=four_star&sortBy=recent,2024-09-21,US,4-5-star
HP DeskJet 2855e,No,Tassel Base,DeskJet,Amazon,Canon PIXMA TS3520,2024-08-27,Liv Rogers,4,"Great price, small printer","I bought this during Prime deals! Great price. Was offered 3 months free ink but I could never get anyone or the website to work to receive free ink without entering cc info and getting a subscription plan. I still like the printer, it’s small, printers well.",,Verified Purchase,,Style: New Version,0,,,,,https://www.amazon.com/HP-DeskJet-Wireless-included-588S5A/product-reviews/B0CT2R7199/ref=cm_cr_arp_d_viewopt_fmt?ie=UTF8&reviewerType=all_reviews&formatType=current_format&pageNumber=2&filterByStar=four_star&sortBy=recent,2024-09-21,US,4-5-star
HP DeskJet 2855e,No,Tassel Base,DeskJet,Amazon,Canon PIXMA TS3520,2024-08-27,Willie Hendrix,4,that it is compatible with chromebook,chromebook is very difficult to find compatible apps and devicies to connect. Sorry I bought a google chrome product,,Verified Purchase,,Style: New Version,0,,,,,https://www.amazon.com/HP-DeskJet-Wireless-included-588S5A/product-reviews/B0CT2R7199/ref=cm_cr_arp_d_viewopt_fmt?ie=UTF8&reviewerType=all_reviews&formatType=current_format&pageNumber=2&filterByStar=four_star&sortBy=recent,2024-09-21,US,4-5-star
HP DeskJet 2855e,No,Tassel Base,DeskJet,Amazon,Canon PIXMA TS3520,2024-08-26,Angel cruz,4,Great,Perfect,,Verified Purchase,,Style: New Version,0,,,,,https://www.amazon.com/HP-DeskJet-Wireless-included-588S5A/product-reviews/B0CT2R7199/ref=cm_cr_arp_d_viewopt_fmt?ie=UTF8&reviewerType=all_reviews&formatType=current_format&pageNumber=2&filterByStar=four_star&sortBy=recent,2024-09-21,US,4-5-star
HP DeskJet 2855e,No,Tassel Base,DeskJet,Amazon,Canon PIXMA TS3520,2024-08-26,Reader Man,4,Good Printer,Prints well,,Verified Purchase,,Style: New Version,0,,,,,https://www.amazon.com/HP-DeskJet-Wireless-included-588S5A/product-reviews/B0CT2R7199/ref=cm_cr_arp_d_viewopt_fmt?ie=UTF8&reviewerType=all_reviews&formatType=current_format&pageNumber=2&filterByStar=four_star&sortBy=recent,2024-09-21,US,4-5-star
HP DeskJet 2855e,No,Tassel Base,DeskJet,Amazon,Canon PIXMA TS3520,2024-08-26,graydog,4,works well,"came on time, it's just what I needed.",,Verified Purchase,,Style: New Version,0,,,,,https://www.amazon.com/HP-DeskJet-Wireless-included-588S5A/product-reviews/B0CT2R7199/ref=cm_cr_arp_d_viewopt_fmt?ie=UTF8&reviewerType=all_reviews&formatType=current_format&pageNumber=2&filterByStar=four_star&sortBy=recent,2024-09-21,US,4-5-star
HP DeskJet 2855e,No,Tassel Base,DeskJet,Amazon,Canon PIXMA TS3520,2024-08-25,Carole,4,Great printer,"The printer was really easy to set up, took no time at all.  I have had no problems with it.  I was worried that I would have trouble connecting to the WiFi, being it is kinda far from the router.  I have had no problems connecting and the print quality is great.  The ink goes fast but I think that is with all printers.",,Verified Purchase,,Style: New Version,0,,,,,https://www.amazon.com/HP-DeskJet-Wireless-included-588S5A/product-reviews/B0CT2R7199/ref=cm_cr_arp_d_viewopt_fmt?ie=UTF8&reviewerType=all_reviews&formatType=current_format&pageNumber=2&filterByStar=four_star&sortBy=recent,2024-09-21,US,4-5-star
HP DeskJet 2855e,No,Tassel Base,DeskJet,Amazon,Canon PIXMA TS3520,2024-08-23,Alli Jo,4,It's alright,"The printer itself is fine. In hindsight, I wish I would've ordered something with an automatic feeder for scanning. I really dislike having to scan one page at a time. I have had the printer less than a month. It prints fine. But..... I already need more ink. And even though I get free ink for 3 months, I feel like I shouldn't have run out of ink already! I have literally only printed maybe 50 pages. After this 3 months is over, I'm switching to another brand. The ink isn't cheap for HP. And other brands are more affordable. Will give this printer to my college kid.",,Verified Purchase,,Style: New Version,0,,,,,https://www.amazon.com/HP-DeskJet-Wireless-included-588S5A/product-reviews/B0CT2R7199/ref=cm_cr_arp_d_viewopt_fmt?ie=UTF8&reviewerType=all_reviews&formatType=current_format&pageNumber=2&filterByStar=four_star&sortBy=recent,2024-09-21,US,4-5-star
HP DeskJet 2855e,No,Tassel Base,DeskJet,Amazon,Canon PIXMA TS3520,2024-08-22,Deanna Helm,4,Works well,"My bad, thought it faxed too.  For the price, it's All Good!",,Verified Purchase,,Style: New Version,0,,,,,https://www.amazon.com/HP-DeskJet-Wireless-included-588S5A/product-reviews/B0CT2R7199/ref=cm_cr_arp_d_viewopt_fmt?ie=UTF8&reviewerType=all_reviews&formatType=current_format&pageNumber=3&filterByStar=four_star&sortBy=recent,2024-09-21,US,4-5-star
HP DeskJet 2855e,No,Tassel Base,DeskJet,Amazon,Canon PIXMA TS3520,2024-08-21,Leeza Zoellers,4,It Makes Quality Copies But It BLOWS Through Ink!,My son needed to print out materials for his Criminology class and it took the entire supplied ink cartridges as well as most of another that we purchased from the store. The quality is good but I can see the replacement ink becoming expensive if he has too much to print in the future. The printer certainly comes in very handy for him and his school work. We are grateful for something that prints well and that was ultimately not very expensive!,,Verified Purchase,,Style: New Version,0,,,,,https://www.amazon.com/HP-DeskJet-Wireless-included-588S5A/product-reviews/B0CT2R7199/ref=cm_cr_arp_d_viewopt_fmt?ie=UTF8&reviewerType=all_reviews&formatType=current_format&pageNumber=3&filterByStar=four_star&sortBy=recent,2024-09-21,US,4-5-star
HP DeskJet 2855e,No,Tassel Base,DeskJet,Amazon,Canon PIXMA TS3520,2024-08-20,josh,4,Difficult to connect wireless,Difficult to connect wireless,,Verified Purchase,,Style: New Version,0,,,,,https://www.amazon.com/HP-DeskJet-Wireless-included-588S5A/product-reviews/B0CT2R7199/ref=cm_cr_arp_d_viewopt_fmt?ie=UTF8&reviewerType=all_reviews&formatType=current_format&pageNumber=3&filterByStar=four_star&sortBy=recent,2024-09-21,US,4-5-star
HP DeskJet 2855e,No,Tassel Base,DeskJet,Amazon,Canon PIXMA TS3520,2024-08-19,Liam,4,"ink costs like the printer itself, so guess what?","you get ink but it lasts 15 black ink pages with text, and the color is perhaps the same, i ran out of ink in the first 4 days after printing text over 15-20 pages.so if you buy, get extra ink",,Verified Purchase,,Style: New Version,0,,,,,https://www.amazon.com/HP-DeskJet-Wireless-included-588S5A/product-reviews/B0CT2R7199/ref=cm_cr_arp_d_viewopt_fmt?ie=UTF8&reviewerType=all_reviews&formatType=current_format&pageNumber=3&filterByStar=four_star&sortBy=recent,2024-09-21,US,4-5-star
HP DeskJet 2855e,No,Tassel Base,DeskJet,Amazon,Canon PIXMA TS3520,2024-08-19,anthony a.,4,paper doesn`t load properly,Only problem I have is the paper doesn`t load,,Verified Purchase,,Style: New Version,0,,,,,https://www.amazon.com/HP-DeskJet-Wireless-included-588S5A/product-reviews/B0CT2R7199/ref=cm_cr_arp_d_viewopt_fmt?ie=UTF8&reviewerType=all_reviews&formatType=current_format&pageNumber=3&filterByStar=four_star&sortBy=recent,2024-09-21,US,4-5-star
HP DeskJet 2855e,No,Tassel Base,DeskJet,Amazon,Canon PIXMA TS3520,2024-08-18,Brown Eyes,4,Convenient,It fit in the spot perfectly,,Verified Purchase,,Style: New Version,0,,,,,https://www.amazon.com/HP-DeskJet-Wireless-included-588S5A/product-reviews/B0CT2R7199/ref=cm_cr_arp_d_viewopt_fmt?ie=UTF8&reviewerType=all_reviews&formatType=current_format&pageNumber=3&filterByStar=four_star&sortBy=recent,2024-09-21,US,4-5-star
HP DeskJet 2855e,No,Tassel Base,DeskJet,Amazon,Canon PIXMA TS3520,2024-08-16,Cathy Schriener,4,Does what it’s supposed to,"Works great, no issues so far.",,Verified Purchase,,Style: New Version,0,,,,,https://www.amazon.com/HP-DeskJet-Wireless-included-588S5A/product-reviews/B0CT2R7199/ref=cm_cr_arp_d_viewopt_fmt?ie=UTF8&reviewerType=all_reviews&formatType=current_format&pageNumber=3&filterByStar=four_star&sortBy=recent,2024-09-21,US,4-5-star
HP DeskJet 2855e,No,Tassel Base,DeskJet,Amazon,Canon PIXMA TS3520,2024-08-15,Mel C,4,Bulky,Great printer but if you are looking for something on the smaller end this is not for you. It was much bigger than expected.,,Verified Purchase,,Style: New Version,0,,,,,https://www.amazon.com/HP-DeskJet-Wireless-included-588S5A/product-reviews/B0CT2R7199/ref=cm_cr_arp_d_viewopt_fmt?ie=UTF8&reviewerType=all_reviews&formatType=current_format&pageNumber=3&filterByStar=four_star&sortBy=recent,2024-09-21,US,4-5-star
HP DeskJet 2855e,No,Tassel Base,DeskJet,Amazon,Canon PIXMA TS3520,2024-08-13,Marilyn,4,Good but Tricky,It is tricky to set up this printer with your computer.It prints great and nice and quiet.,,Verified Purchase,,Style: New Version,0,,,,,https://www.amazon.com/HP-DeskJet-Wireless-included-588S5A/product-reviews/B0CT2R7199/ref=cm_cr_arp_d_viewopt_fmt?ie=UTF8&reviewerType=all_reviews&formatType=current_format&pageNumber=3&filterByStar=four_star&sortBy=recent,2024-09-21,US,4-5-star
HP DeskJet 2855e,No,Tassel Base,DeskJet,Amazon,Canon PIXMA TS3520,2024-08-13,Steven Holmes,4,Overall good product,"I've been happy with this since I've gotten it. Only problem is that I thought it had scanning, but can't seem to figure that part out. I'm also curious how much ink refills are and how long they last. But, seems to work just fine for what I'm using it for which is pretty basic.",,Verified Purchase,,Style: New Version,0,,,,,https://www.amazon.com/HP-DeskJet-Wireless-included-588S5A/product-reviews/B0CT2R7199/ref=cm_cr_arp_d_viewopt_fmt?ie=UTF8&reviewerType=all_reviews&formatType=current_format&pageNumber=3&filterByStar=four_star&sortBy=recent,2024-09-21,US,4-5-star
HP DeskJet 2855e,No,Tassel Base,DeskJet,Amazon,Canon PIXMA TS3520,2024-08-10,Darian Campbell,4,Works well!,This is a great printer! My only problem is that it took me quite awhile to figure out how to scan things. I had to turn to google. And it also disconnects from my computer often. And it’s only about 3 feet away from it.,,Verified Purchase,,Style: New Version,0,,,,,https://www.amazon.com/HP-DeskJet-Wireless-included-588S5A/product-reviews/B0CT2R7199/ref=cm_cr_arp_d_viewopt_fmt?ie=UTF8&reviewerType=all_reviews&formatType=current_format&pageNumber=4&filterByStar=four_star&sortBy=recent,2024-09-21,US,4-5-star
HP DeskJet 2855e,No,Tassel Base,DeskJet,Amazon,Canon PIXMA TS3520,2024-08-10,Pat,4,"Good Copying, But…","I am wishing for 2-side copying, but other than that, the copies are clear and look quite good.",,Verified Purchase,,Style: New Version,0,,,,,https://www.amazon.com/HP-DeskJet-Wireless-included-588S5A/product-reviews/B0CT2R7199/ref=cm_cr_arp_d_viewopt_fmt?ie=UTF8&reviewerType=all_reviews&formatType=current_format&pageNumber=4&filterByStar=four_star&sortBy=recent,2024-09-21,US,4-5-star
HP DeskJet 2855e,No,Tassel Base,DeskJet,Amazon,Canon PIXMA TS3520,2024-08-08,Shelby,4,You have to flip the pages when printing on both sides.,"The printer works AMAZING. Very easy to set up. Good color and ink. BUT, and I know this is probably my fault, but I didn't realize that you have to FLIP the pages manually every time you print on both sides. As an author... you can imagine this is a dealbreaker for me. It's too late to send it back so I'll just keep it for smaller print jobs, but as an automatic printer, it is NOT.",,Verified Purchase,,Style: New Version,0,,,,,https://www.amazon.com/HP-DeskJet-Wireless-included-588S5A/product-reviews/B0CT2R7199/ref=cm_cr_arp_d_viewopt_fmt?ie=UTF8&reviewerType=all_reviews&formatType=current_format&pageNumber=4&filterByStar=four_star&sortBy=recent,2024-09-21,US,4-5-star
HP DeskJet 2855e,No,Tassel Base,DeskJet,Amazon,Canon PIXMA TS3520,2024-08-08,Goodman Clan,4,"Good quality, comes with ink, great for college","I had a lot of connectivity issues with this one, but once it connects I have no issues with it. Was able to print in color and black and white. It’s relatively small for a printer, I store it under my desk. It comes with complementary ink which I always like. If you don’t use printers too much, I’d recommend this printer",,Verified Purchase,,Style: New Version,2,,,,,https://www.amazon.com/HP-DeskJet-Wireless-included-588S5A/product-reviews/B0CT2R7199/ref=cm_cr_arp_d_viewopt_fmt?ie=UTF8&reviewerType=all_reviews&formatType=current_format&pageNumber=4&filterByStar=four_star&sortBy=recent,2024-09-21,US,4-5-star
HP DeskJet 2855e,No,Tassel Base,DeskJet,Amazon,Canon PIXMA TS3520,2024-08-07,SP,4,Good quality print,"Inexpensive, functional, wireless (only supports 2g). Print quality is good.",,Verified Purchase,,Style: New Version,0,,,,,https://www.amazon.com/HP-DeskJet-Wireless-included-588S5A/product-reviews/B0CT2R7199/ref=cm_cr_arp_d_viewopt_fmt?ie=UTF8&reviewerType=all_reviews&formatType=current_format&pageNumber=4&filterByStar=four_star&sortBy=recent,2024-09-21,US,4-5-star
HP DeskJet 2855e,No,Tassel Base,DeskJet,Amazon,Canon PIXMA TS3520,2024-08-06,virginia beckman,4,I don’t want the automatic delivery of ink.,It is easy to use. Printing and scanning.,,Verified Purchase,,Style: New Version,0,,,,,https://www.amazon.com/HP-DeskJet-Wireless-included-588S5A/product-reviews/B0CT2R7199/ref=cm_cr_arp_d_viewopt_fmt?ie=UTF8&reviewerType=all_reviews&formatType=current_format&pageNumber=4&filterByStar=four_star&sortBy=recent,2024-09-21,US,4-5-star
