Review_Model,Competitor_Flag,HP_Class,Segment,Retailer,Comp_Model,Review_Date,Review_Name,Review_Rating,Review_Title,Review_Content,Seeding_Flag,Verified_Purchase_Flag,Promotion_Flag,Aggregation_Flag,People_Find_Helpful,Syndicated_Source,Response_Date,Response_Text,Response_Name,URL,Scraping_Date,Country,Review_Rating_Label
HP DeskJet 2855e,No,Tassel Base,DeskJet,Amazon,Canon PIXMA TS3520,2024-09-03,Kim M.,3,"Ink deal , ink sent was empty cartridges","The product itself is working fine, the original ink with package was fine. The free ink for 3 months deal the next ink sent was empty and did not work.",,Verified Purchase,,Style: New Version,0,,,,,https://www.amazon.com/HP-DeskJet-Wireless-included-588S5A/product-reviews/B0CT2R7199/ref=cm_cr_arp_d_viewopt_fmt?ie=UTF8&reviewerType=all_reviews&formatType=current_format&pageNumber=1&filterByStar=three_star&sortBy=recent,2024-09-21,US,1-2-3-star
HP DeskJet 2855e,No,Tassel Base,DeskJet,Amazon,Canon PIXMA TS3520,2024-09-03,Alec Bates,3,Be aware: Subscription Printer,"Ill make it short and sweet. Ive had this printer for about 6 months. In terms of functionality, this printer has worked really well for me. Never had any issues with connectivity or even the hp printer software. The only issue (someone else used this term well), this printer is not yours after you buy it. It is essentially a rental. If you do not have a currently active instant ink subscription service going, hp software will not allow you to print anything. Now, the service is relatively inexpensive. About $6 or $7 a month and Ive never been in a spot where I am out of ink. But for those of us who only print a few pages a couple of days out if the month, this will not be the best printer to get. Ive had a payment not go through once due to me getting a new debit card and it took me a good 20 minutes to get it up and going again after changing my payment info. Doesn’t matter how many pages you printed, how much ink you have used. You’re giving them $6 and swapping out your hardly used ink carts for new ones or else you will not be allowed to use the printer. Pretty shady if you ask me and im not comfortable with the way they can remotely prevent you from using your printer that you already purchased. Ill be continuing to use mine until i can eventually afford something that is better fit for less frequent printing/cart replacements but if you’re reading this. Id recommend avoiding any hp printer that requires you to have an instant ink subscription.",,,,Style: New Version,0,,,,,https://www.amazon.com/HP-DeskJet-Wireless-included-588S5A/product-reviews/B0CT2R7199/ref=cm_cr_arp_d_viewopt_fmt?ie=UTF8&reviewerType=all_reviews&formatType=current_format&pageNumber=1&filterByStar=three_star&sortBy=recent,2024-09-21,US,1-2-3-star
HP DeskJet 2855e,No,Tassel Base,DeskJet,Amazon,Canon PIXMA TS3520,2024-08-31,millerj,3,Misleading Advertising,"I love HP products. The printer arrived on time. It's the perfect size for my space. I already have a large Brothet printer for large jobs... I just needed something small for smaller jobs. It looks great, and works great right out of the box. Set up was easy. With that said, I gave 3 stars because I would have bought a different model if this one wasn't offering free ink for 3 months. This is very misleading. They want you to set up automatic subscription for replacement ink. Also, the 1 free ink that came with it only made 20 copies... so disappointed. If it wasn't already set up, I'd send it back.",,Verified Purchase,,Style: New Version,0,,,,,https://www.amazon.com/HP-DeskJet-Wireless-included-588S5A/product-reviews/B0CT2R7199/ref=cm_cr_arp_d_viewopt_fmt?ie=UTF8&reviewerType=all_reviews&formatType=current_format&pageNumber=1&filterByStar=three_star&sortBy=recent,2024-09-21,US,1-2-3-star
HP DeskJet 2855e,No,Tassel Base,DeskJet,Amazon,Canon PIXMA TS3520,2024-08-28,nodrog,3,You get what you pay for,Good print quality but very difficult to set up software with Android devices and only works on 2G networks!! What's with that??,,Verified Purchase,,Style: New Version,0,,,,,https://www.amazon.com/HP-DeskJet-Wireless-included-588S5A/product-reviews/B0CT2R7199/ref=cm_cr_arp_d_viewopt_fmt?ie=UTF8&reviewerType=all_reviews&formatType=current_format&pageNumber=1&filterByStar=three_star&sortBy=recent,2024-09-21,US,1-2-3-star
HP DeskJet 2855e,No,Tassel Base,DeskJet,Amazon,Canon PIXMA TS3520,2024-08-27,janne1845,3,HP Printer,Good price for home use.  Not easy to install.,,Verified Purchase,,Style: New Version,0,,,,,https://www.amazon.com/HP-DeskJet-Wireless-included-588S5A/product-reviews/B0CT2R7199/ref=cm_cr_arp_d_viewopt_fmt?ie=UTF8&reviewerType=all_reviews&formatType=current_format&pageNumber=1&filterByStar=three_star&sortBy=recent,2024-09-21,US,1-2-3-star
HP DeskJet 2855e,No,Tassel Base,DeskJet,Amazon,Canon PIXMA TS3520,2024-08-26,Travelgirl,3,Eats Ink Up Quickly!,"This printer is good for people who occasionally need a printer but not for someone who uses it daily or frequently. It runs out of ink quickly. Also, if you need to scan you have to scan 1 page at a time, it will take a while if you need multiple pages.",,,,Style: New Version,0,,,,,https://www.amazon.com/HP-DeskJet-Wireless-included-588S5A/product-reviews/B0CT2R7199/ref=cm_cr_arp_d_viewopt_fmt?ie=UTF8&reviewerType=all_reviews&formatType=current_format&pageNumber=1&filterByStar=three_star&sortBy=recent,2024-09-21,US,1-2-3-star
HP DeskJet 2855e,No,Tassel Base,DeskJet,Amazon,Canon PIXMA TS3520,2024-08-25,Iris,3,Does not connect to Wifi,This printer is cute but if you are older or not ad tech savvy this is kind of difícil to set up. I'm young and some what tech savvy and still can't get this printer connected. It keeps saying no connections and I have to keep turning it of and on and wasting paper ans ink printing the wifi instructions because that is the only way. The app works if you connected to your wifi first then loging in and connecting to the printer still don't fully connect. Then I've had the printer less than a month and barely printed 20 pages and I'm already out of ink then I go and connect it to get that instead ink 3 months free of cartridge and it kept telling me since I cannot connect the printer it won't sent it. So I tried connecting the printer on my phone will having the app loaded on my computer and it still won't connected I've just had alot of trouble with this printer and I'm going to exchange it for a diferent brand,,Verified Purchase,,Style: New Version,0,,,,,https://www.amazon.com/HP-DeskJet-Wireless-included-588S5A/product-reviews/B0CT2R7199/ref=cm_cr_arp_d_viewopt_fmt?ie=UTF8&reviewerType=all_reviews&formatType=current_format&pageNumber=2&filterByStar=three_star&sortBy=recent,2024-09-21,US,1-2-3-star
HP DeskJet 2855e,No,Tassel Base,DeskJet,Amazon,Canon PIXMA TS3520,2024-08-24,Kim,3,Ink that comes with printer is not compatible.,Printer shows E0 unsuitable cartridge.That’s the ink that came with printer.,,Verified Purchase,,Style: New Version,0,,,,,https://www.amazon.com/HP-DeskJet-Wireless-included-588S5A/product-reviews/B0CT2R7199/ref=cm_cr_arp_d_viewopt_fmt?ie=UTF8&reviewerType=all_reviews&formatType=current_format&pageNumber=2&filterByStar=three_star&sortBy=recent,2024-09-21,US,1-2-3-star
HP DeskJet 2855e,No,Tassel Base,DeskJet,Amazon,Canon PIXMA TS3520,2024-08-24,Joanie Boone,3,Product did not work with network.,Printer did not recognize our wireless network!,,Verified Purchase,,Style: New Version,0,,,,,https://www.amazon.com/HP-DeskJet-Wireless-included-588S5A/product-reviews/B0CT2R7199/ref=cm_cr_arp_d_viewopt_fmt?ie=UTF8&reviewerType=all_reviews&formatType=current_format&pageNumber=2&filterByStar=three_star&sortBy=recent,2024-09-21,US,1-2-3-star
HP DeskJet 2855e,No,Tassel Base,DeskJet,Amazon,Canon PIXMA TS3520,2024-08-23,Olga E Rudolph,3,Very basic and flimsy,Got as a present. Feels cheap and not great quality.,,Verified Purchase,,Style: New Version,0,,,,,https://www.amazon.com/HP-DeskJet-Wireless-included-588S5A/product-reviews/B0CT2R7199/ref=cm_cr_arp_d_viewopt_fmt?ie=UTF8&reviewerType=all_reviews&formatType=current_format&pageNumber=2&filterByStar=three_star&sortBy=recent,2024-09-21,US,1-2-3-star
HP DeskJet 2855e,No,Tassel Base,DeskJet,Amazon,Canon PIXMA TS3520,2024-08-21,Joy H.,3,Printer,Hard to setup but I was in a hurry. Just moved so I will try again. Test page printed nicely. Speed is decent.,,Verified Purchase,,Style: New Version,0,,,,,https://www.amazon.com/HP-DeskJet-Wireless-included-588S5A/product-reviews/B0CT2R7199/ref=cm_cr_arp_d_viewopt_fmt?ie=UTF8&reviewerType=all_reviews&formatType=current_format&pageNumber=2&filterByStar=three_star&sortBy=recent,2024-09-21,US,1-2-3-star
HP DeskJet 2855e,No,Tassel Base,DeskJet,Amazon,Canon PIXMA TS3520,2024-08-20,D.B. Haler,3,Better order ink now!,The printer works ok now that we got past the wonky software set-up. Best be aware: go ahead and order ink cartridges now. They sent cartridges that needed replacement after ten (10) sheets of printing:(,,Verified Purchase,,Style: New Version,0,,,,,https://www.amazon.com/HP-DeskJet-Wireless-included-588S5A/product-reviews/B0CT2R7199/ref=cm_cr_arp_d_viewopt_fmt?ie=UTF8&reviewerType=all_reviews&formatType=current_format&pageNumber=2&filterByStar=three_star&sortBy=recent,2024-09-21,US,1-2-3-star
HP DeskJet 2855e,No,Tassel Base,DeskJet,Amazon,Canon PIXMA TS3520,2024-08-18,Jess Mc,3,Works ok,"You get what you pay for here. It works good enough in a pinch but the prints aren’t clear. Text is pretty blurry but still legible for the most part. Also very slow command connection so it takes like 5 minutes for it to print after telling it to do so via WiFi/Bluetooth. The printing itself is also very slow. Setup was a little confusing as well but we figured it out. I do like that it came with ink included and doubles as a scanner and copier. For the price, I guess I shouldn’t have expected much better.",,Verified Purchase,,Style: New Version,2,,,,,https://www.amazon.com/HP-DeskJet-Wireless-included-588S5A/product-reviews/B0CT2R7199/ref=cm_cr_arp_d_viewopt_fmt?ie=UTF8&reviewerType=all_reviews&formatType=current_format&pageNumber=2&filterByStar=three_star&sortBy=recent,2024-09-21,US,1-2-3-star
HP DeskJet 2855e,No,Tassel Base,DeskJet,Amazon,Canon PIXMA TS3520,2024-08-17,Abigail Vangsnes,3,Trouble connecting,"I was disappointed when this printer wanted me to purchase a monthly subscription plan. I bypassed that option, but the printer doesn’t work well. It needs to be turned off and back on any time I need to print something. I won’t be buying from this company again.",,Verified Purchase,,Style: New Version,0,,,,,https://www.amazon.com/HP-DeskJet-Wireless-included-588S5A/product-reviews/B0CT2R7199/ref=cm_cr_arp_d_viewopt_fmt?ie=UTF8&reviewerType=all_reviews&formatType=current_format&pageNumber=2&filterByStar=three_star&sortBy=recent,2024-09-21,US,1-2-3-star
HP DeskJet 2855e,No,Tassel Base,DeskJet,Amazon,Canon PIXMA TS3520,2024-08-13,K,3,Wireless operations are compatible with 2.4 GHz operations only,"Make sure you read the details before purchasing or you too might be very unhappy. Compatible with 2.4 GHz WIRELESS NETWORKS only. This means if your home has a 5GHz network, you might want to be sure you have the option of turning on a 2.4 so you can switch when you need to print.Or always run your home computer on a slower 2.4 wifi connection? Thanks HP. This is not at all helpful.",,Verified Purchase,,Style: New Version,0,,,,,https://www.amazon.com/HP-DeskJet-Wireless-included-588S5A/product-reviews/B0CT2R7199/ref=cm_cr_arp_d_viewopt_fmt?ie=UTF8&reviewerType=all_reviews&formatType=current_format&pageNumber=2&filterByStar=three_star&sortBy=recent,2024-09-21,US,1-2-3-star
HP DeskJet 2855e,No,Tassel Base,DeskJet,Amazon,Canon PIXMA TS3520,2024-08-13,Gene Shk,3,Low speed and need 2.4g system,Unfortunately this model won’t work with high speed internetAlso once you are able to connect it it prints fairly slow even though the quality is goodIf I had to buy again o would go with a different modelThe size is okey it’s not tiny but not bulky either,,Verified Purchase,,Style: New Version,0,,,,,https://www.amazon.com/HP-DeskJet-Wireless-included-588S5A/product-reviews/B0CT2R7199/ref=cm_cr_arp_d_viewopt_fmt?ie=UTF8&reviewerType=all_reviews&formatType=current_format&pageNumber=2&filterByStar=three_star&sortBy=recent,2024-09-21,US,1-2-3-star
HP DeskJet 2855e,No,Tassel Base,DeskJet,Amazon,Canon PIXMA TS3520,2024-08-10,Marcia Bliss,3,printer,Will only print on certain sites.,,Verified Purchase,,Style: New Version,0,,,,,https://www.amazon.com/HP-DeskJet-Wireless-included-588S5A/product-reviews/B0CT2R7199/ref=cm_cr_arp_d_viewopt_fmt?ie=UTF8&reviewerType=all_reviews&formatType=current_format&pageNumber=3&filterByStar=three_star&sortBy=recent,2024-09-21,US,1-2-3-star
HP DeskJet 2855e,No,Tassel Base,DeskJet,Amazon,Canon PIXMA TS3520,2024-08-10,James,3,Basic,"Cheap.  Can't control print quality.  Doesn't fax.  No feed for copies, one at a time.  Basic printing, but okay.",,Verified Purchase,,Style: New Version,0,,,,,https://www.amazon.com/HP-DeskJet-Wireless-included-588S5A/product-reviews/B0CT2R7199/ref=cm_cr_arp_d_viewopt_fmt?ie=UTF8&reviewerType=all_reviews&formatType=current_format&pageNumber=3&filterByStar=three_star&sortBy=recent,2024-09-21,US,1-2-3-star
HP DeskJet 2855e,No,Tassel Base,DeskJet,Amazon,Canon PIXMA TS3520,2024-08-09,Amazon Customer,3,Not that good,"I bought this printer to replace my old HP printer 5500. This one is a little more difficult to set up. there's not screen on it. Also, I can't get it to print in color :(What a waste.",,Verified Purchase,,Style: New Version,0,,,,,https://www.amazon.com/HP-DeskJet-Wireless-included-588S5A/product-reviews/B0CT2R7199/ref=cm_cr_arp_d_viewopt_fmt?ie=UTF8&reviewerType=all_reviews&formatType=current_format&pageNumber=3&filterByStar=three_star&sortBy=recent,2024-09-21,US,1-2-3-star
HP DeskJet 2855e,No,Tassel Base,DeskJet,Amazon,Canon PIXMA TS3520,2024-08-09,Kat,3,Disappointed,"Price was great, B/W printing is acceptable for this casual user, but It does not print in color, despite a new cartridge.  I'm sending the print jobs from a MAC desktop computer.  The test page printed in color, so I know its capable.  What am I doing wrong?!?",,Verified Purchase,,Style: New Version,0,,,,,https://www.amazon.com/HP-DeskJet-Wireless-included-588S5A/product-reviews/B0CT2R7199/ref=cm_cr_arp_d_viewopt_fmt?ie=UTF8&reviewerType=all_reviews&formatType=current_format&pageNumber=3&filterByStar=three_star&sortBy=recent,2024-09-21,US,1-2-3-star
HP DeskJet 2855e,No,Tassel Base,DeskJet,Amazon,Canon PIXMA TS3520,2024-08-08,Peggy,3,TEMPERAMENTAL!,"I have owned and used many HP printers & copiers over the years, but I must say that this one continues to be very temperamental.  It took 3 days of constant working with it just to get the Wi-Fi to link.  This was super frustrating especially since the manufacturer made it clear in the instructions NOT to use a USB cord to connect it.  5 weeks after purchase and it still prints 'when it wants to'.  It constantly falls ""offline"".  I waited before offering a review hoping that it would get better, but it hasn't.  Each time that I have to use it now, I find myself saying a quick prayer in the hopes that it will work today.  (This is where I normally would say LOL, but it is not funny.  It is frustrating.)  Several times I considered returning it to Amazon, but because of its low cost and the hassle that I would have to go through, it was not worth returning it.  I keep it for now and most likely, will purchase a better printer soon.  I would recommend this printer for grandparents; definitely not for students, businesses, or anyone having deadlines to meet.  Otherwise prefer yourself for much frustration.",,Verified Purchase,,Style: New Version,0,,,,,https://www.amazon.com/HP-DeskJet-Wireless-included-588S5A/product-reviews/B0CT2R7199/ref=cm_cr_arp_d_viewopt_fmt?ie=UTF8&reviewerType=all_reviews&formatType=current_format&pageNumber=3&filterByStar=three_star&sortBy=recent,2024-09-21,US,1-2-3-star
HP DeskJet 2855e,No,Tassel Base,DeskJet,Amazon,Canon PIXMA TS3520,2024-08-06,Kaelyn,3,theee most basic yet frustrating printer,"this printer is good for literally the bare minimum, and even then it struggles. It's constantly disconnecting from the wifi and refusing to reconnect, the scanner warps colors so bad, and it will sometimes take minutes to print a single page. I print maybe 2 pages a week and every time I do its a 20 minute ordeal.",,Verified Purchase,,Style: New Version,0,,,,,https://www.amazon.com/HP-DeskJet-Wireless-included-588S5A/product-reviews/B0CT2R7199/ref=cm_cr_arp_d_viewopt_fmt?ie=UTF8&reviewerType=all_reviews&formatType=current_format&pageNumber=3&filterByStar=three_star&sortBy=recent,2024-09-21,US,1-2-3-star
HP DeskJet 2855e,No,Tassel Base,DeskJet,Amazon,Canon PIXMA TS3520,2024-08-06,Brooke Calders,3,It’s ok,A little difficult in setting up and connecting to your phone. Ink dies not last long. Had to change the cartridge at 3 weeks with very minimal use.,,Verified Purchase,,Style: New Version,0,,,,,https://www.amazon.com/HP-DeskJet-Wireless-included-588S5A/product-reviews/B0CT2R7199/ref=cm_cr_arp_d_viewopt_fmt?ie=UTF8&reviewerType=all_reviews&formatType=current_format&pageNumber=3&filterByStar=three_star&sortBy=recent,2024-09-21,US,1-2-3-star
HP DeskJet 2855e,No,Tassel Base,DeskJet,Amazon,Canon PIXMA TS3520,2024-08-05,Amazon Customer,3,Very light weight and ink runs out very fast.,"The printer is very light, in weight and the ink runs out very fast for general memo documents.",,Verified Purchase,,Style: New Version,0,,,,,https://www.amazon.com/HP-DeskJet-Wireless-included-588S5A/product-reviews/B0CT2R7199/ref=cm_cr_arp_d_viewopt_fmt?ie=UTF8&reviewerType=all_reviews&formatType=current_format&pageNumber=3&filterByStar=three_star&sortBy=recent,2024-09-21,US,1-2-3-star
HP DeskJet 2855e,No,Tassel Base,DeskJet,Amazon,Canon PIXMA TS3520,2024-08-05,Carol,3,Doesn't have a USB port,If you don't have Wi-Fi it is hard to use this printer it will print if you scan it and print it. But you have to use a USB port to use with your Chromebook,,Verified Purchase,,Style: New Version,0,,,,,https://www.amazon.com/HP-DeskJet-Wireless-included-588S5A/product-reviews/B0CT2R7199/ref=cm_cr_arp_d_viewopt_fmt?ie=UTF8&reviewerType=all_reviews&formatType=current_format&pageNumber=3&filterByStar=three_star&sortBy=recent,2024-09-21,US,1-2-3-star
HP DeskJet 2855e,No,Tassel Base,DeskJet,Amazon,Canon PIXMA TS3520,2024-08-05,glenda & gary  kerr,3,Ink cartridge,"Got printer set fast but had a few issues.Got everything set  finally ,but got error saying out of in ?Had to go buy a new cartridge of black ink .Cartridge that came with is was defective?Working fine now",,Verified Purchase,,Style: New Version,0,,,,,https://www.amazon.com/HP-DeskJet-Wireless-included-588S5A/product-reviews/B0CT2R7199/ref=cm_cr_arp_d_viewopt_fmt?ie=UTF8&reviewerType=all_reviews&formatType=current_format&pageNumber=3&filterByStar=three_star&sortBy=recent,2024-09-21,US,1-2-3-star
HP DeskJet 2855e,No,Tassel Base,DeskJet,Amazon,Canon PIXMA TS3520,2024-08-02,Sarah Walker-Hitt,3,Hard to connect,I’m still trying to connect to my wifi. It keeps telling me my key code is wrong and it isn’t! Any ideas?The print looks good on a copy though.,,Verified Purchase,,Style: New Version,0,,,,,https://www.amazon.com/HP-DeskJet-Wireless-included-588S5A/product-reviews/B0CT2R7199/ref=cm_cr_arp_d_viewopt_fmt?ie=UTF8&reviewerType=all_reviews&formatType=current_format&pageNumber=4&filterByStar=three_star&sortBy=recent,2024-09-21,US,1-2-3-star
HP DeskJet 2855e,No,Tassel Base,DeskJet,Amazon,Canon PIXMA TS3520,2024-08-02,Dustan Foret,3,Perfect for light home use,"If you need something for 50 pages or less a month. This is it. It does print slower than other HP printers, but is perfect for here and there printing. Had no issues setting up and getting started.",,Verified Purchase,,Style: New Version,0,,,,,https://www.amazon.com/HP-DeskJet-Wireless-included-588S5A/product-reviews/B0CT2R7199/ref=cm_cr_arp_d_viewopt_fmt?ie=UTF8&reviewerType=all_reviews&formatType=current_format&pageNumber=4&filterByStar=three_star&sortBy=recent,2024-09-21,US,1-2-3-star
HP DeskJet 2855e,No,Tassel Base,DeskJet,Amazon,Canon PIXMA TS3520,2024-08-02,ToiHouse,3,It took 3 hours to set up,I printed out 11 pages in color and I got the message that is low in ink.  Really?!,,Verified Purchase,,Style: New Version,0,,,,,https://www.amazon.com/HP-DeskJet-Wireless-included-588S5A/product-reviews/B0CT2R7199/ref=cm_cr_arp_d_viewopt_fmt?ie=UTF8&reviewerType=all_reviews&formatType=current_format&pageNumber=4&filterByStar=three_star&sortBy=recent,2024-09-21,US,1-2-3-star
HP DeskJet 2855e,No,Tassel Base,DeskJet,Amazon,Canon PIXMA TS3520,2024-08-01,Fall,3,Fast,"""The ink did not last 3 months; it lasted about a month.""",,Verified Purchase,,Style: New Version,0,,,,,https://www.amazon.com/HP-DeskJet-Wireless-included-588S5A/product-reviews/B0CT2R7199/ref=cm_cr_arp_d_viewopt_fmt?ie=UTF8&reviewerType=all_reviews&formatType=current_format&pageNumber=4&filterByStar=three_star&sortBy=recent,2024-09-21,US,1-2-3-star
HP DeskJet 2855e,No,Tassel Base,DeskJet,Amazon,Canon PIXMA TS3520,2024-08-01,Ajariah Thompson,3,Ok printer,Setup was annoying at first but it seems like an okay printer.,,Verified Purchase,,Style: New Version,0,,,,,https://www.amazon.com/HP-DeskJet-Wireless-included-588S5A/product-reviews/B0CT2R7199/ref=cm_cr_arp_d_viewopt_fmt?ie=UTF8&reviewerType=all_reviews&formatType=current_format&pageNumber=4&filterByStar=three_star&sortBy=recent,2024-09-21,US,1-2-3-star
HP DeskJet 2855e,No,Tassel Base,DeskJet,Amazon,Canon PIXMA TS3520,2024-07-31,ryesha,3,Helpful but a headache,Helpful but a headache sometimes I have a love hate relationship with this printer scanner !Takes 67 or 67xl ink tri color and black and white cartridges,,Verified Purchase,,Style: New Version,0,,,,,https://www.amazon.com/HP-DeskJet-Wireless-included-588S5A/product-reviews/B0CT2R7199/ref=cm_cr_arp_d_viewopt_fmt?ie=UTF8&reviewerType=all_reviews&formatType=current_format&pageNumber=4&filterByStar=three_star&sortBy=recent,2024-09-21,US,1-2-3-star
HP DeskJet 2855e,No,Tassel Base,DeskJet,Amazon,Canon PIXMA TS3520,2024-07-31,Mark B.,3,"Eh, all right, I suppose",Slower than I expected. Also larger footprint than I expected. It doesn't really fit well under my computer desk where my old printer was. Set-up was easy. Works fine. Just slower anf bigger than desired.Update: it just jammed again.  I've only had this for a few weeks and it has already jammed a bunch of times.,,Verified Purchase,,Style: New Version,0,,,,,https://www.amazon.com/HP-DeskJet-Wireless-included-588S5A/product-reviews/B0CT2R7199/ref=cm_cr_arp_d_viewopt_fmt?ie=UTF8&reviewerType=all_reviews&formatType=current_format&pageNumber=4&filterByStar=three_star&sortBy=recent,2024-09-21,US,1-2-3-star
HP DeskJet 2855e,No,Tassel Base,DeskJet,Amazon,Canon PIXMA TS3520,2024-07-30,OSCAR,3,"Great, when it works!","I don’t print very often, but when I do, it’s takes at least 10 minutes to get it reconnected to WiFi. Very frustrating.",,Verified Purchase,,Style: New Version,0,,,,,https://www.amazon.com/HP-DeskJet-Wireless-included-588S5A/product-reviews/B0CT2R7199/ref=cm_cr_arp_d_viewopt_fmt?ie=UTF8&reviewerType=all_reviews&formatType=current_format&pageNumber=4&filterByStar=three_star&sortBy=recent,2024-09-21,US,1-2-3-star
HP DeskJet 2855e,No,Tassel Base,DeskJet,Amazon,Canon PIXMA TS3520,2024-07-30,Melly,3,Gets the job done…But…,But prints about as fast as a caterpillar carrying buckets up a hill! Painfully slow!,,Verified Purchase,,Style: New Version,0,,,,,https://www.amazon.com/HP-DeskJet-Wireless-included-588S5A/product-reviews/B0CT2R7199/ref=cm_cr_arp_d_viewopt_fmt?ie=UTF8&reviewerType=all_reviews&formatType=current_format&pageNumber=4&filterByStar=three_star&sortBy=recent,2024-09-21,US,1-2-3-star
HP DeskJet 2855e,No,Tassel Base,DeskJet,Amazon,Canon PIXMA TS3520,2024-07-29,Maureen Ramos,3,Works great,Works great; but sometimes has connection problems with the wifi.,,Verified Purchase,,Style: New Version,0,,,,,https://www.amazon.com/HP-DeskJet-Wireless-included-588S5A/product-reviews/B0CT2R7199/ref=cm_cr_arp_d_viewopt_fmt?ie=UTF8&reviewerType=all_reviews&formatType=current_format&pageNumber=4&filterByStar=three_star&sortBy=recent,2024-09-21,US,1-2-3-star
HP DeskJet 2855e,No,Tassel Base,DeskJet,Amazon,Canon PIXMA TS3520,2024-07-28,Katie burris,3,Was a nightmare to set up,"I have always had HP printers my whole life and they have been relatively easy to set up, but this one was a nightmare for me to set up and maybe because it’s the cheapest printer I’ve ever bought but after a couple of hours, it was ready to print my return label That I desperately needed for FedEx pick up in the morning so overall it will serve its purpose",,Verified Purchase,,Style: New Version,0,,,,,https://www.amazon.com/HP-DeskJet-Wireless-included-588S5A/product-reviews/B0CT2R7199/ref=cm_cr_arp_d_viewopt_fmt?ie=UTF8&reviewerType=all_reviews&formatType=current_format&pageNumber=5&filterByStar=three_star&sortBy=recent,2024-09-21,US,1-2-3-star
HP DeskJet 2855e,No,Tassel Base,DeskJet,Amazon,Canon PIXMA TS3520,2024-07-28,CPG,3,Decent value,"There is a small damage to it, as pictured, when I unboxed it. It doesn't affect the functionality so I choose not to return it as I need it for a project this week.  There also was no PIN or code included for the 3 month free ink trial. But otherwise seems to be a decent value for the price.",,Verified Purchase,,Style: New Version,0,,,,,https://www.amazon.com/HP-DeskJet-Wireless-included-588S5A/product-reviews/B0CT2R7199/ref=cm_cr_arp_d_viewopt_fmt?ie=UTF8&reviewerType=all_reviews&formatType=current_format&pageNumber=5&filterByStar=three_star&sortBy=recent,2024-09-21,US,1-2-3-star
